Corinthia Hotel London,5,"Back again, and still loving the Corinthia","We enjoyed our November visit to the Corinthia so much that we returned the end of May. I'm still in love with this place, and do plan to visit again, although we did have one nuisance of a problem. The internet service in our room was very spotty, and mostly did not work. I twice reported that we were not getting service, but nothing happened. I did mention it again at checkout, as I was surprised/disappointed by the lack of response. A few days later, I received a very concerned email from the hotel manager, who offered to personally book our next visit, so.... my point is not to complain or extoll here, but just to let readers know what happened. I, personally, am satisfied, and would definitely go back. | Our room was an upgrade, and the bathroom was gorgeous, with an oversize, freestanding, Roman tile tub. The bed and furnishings were lovely and comfortable, and we had a nice view to the Eye. | I do love the location, and we were lucky, as we were there for 9 of the only sunny days I think the city has had this summer ! (It started to rain the day we left, the day before the Queen's Jubilee. ) The fine weather made walking so easy and pleasant. Went to the Chelsea Flower Show, which is definitely worth the visit. | One disappointment was Massimo's. In November, we ate there once, and it was excellent. This time, it really was mediocre, I'm afraid. I hope they step it up and make it good again, because the space the restaurant occupies is beautiful. | Room service breakfast was excellent and punctual. | Bar service at North Hall was excellent. | Wait service in the lobby, where I spent a lot of time, was really spotty. You had to really flag the staff down, except for one man, who seemed to be the manager. He was always on the ball. I was chatting with a pretty major celebrity one day, and he mentioned the same thing about having to flag them down, so at least they don't treat a celeb differently than any other! | The spa and workout area was wonderful, once again. So clean and perfect and professional. I had the excellent Sinead for a facial, and later, for a massage. | I highly recommend these restaurants: Ottolengthi's new Nopi; Veeraswamy (elegant, delicious Indian), Wild Honey (so good!!), Mele E Pere, &amp; The Wolseley (worth it just to experience the space). | All in all, I hope to visit again next fall or winter.","Boston, MA",7/17/2012
Rhodes Hotel,4,pochi giorni...ma buoni!,"Splendida Londra, | apprezzata ancor più perchè la posizione dell'hotel consente di visitarla comodamente. | Ottima prima colazione, personale gentile, camere pulite..peccato essere tornati. | Thank you we will return!",London,2/19/2013
Ridgemount Hotel,4,affordable and friendly base to explore London,"This place is situated in a row of hotels catering to the budget traveller who is not afraid of taking care of themselves or taking advice from the very helpful and down to earth folks running this place. Great location near almost anything you'd want to do in the western part of London, tons of great eats, museums, shops, etc... rooms are basic but clean and comfortable. breakfast is good and the folks again are super helpful. close to several different underground lines so you can shoot off in almost any direction.",NA,6/9/2016
The Savoy,5,"Oustanding hotel, staff and food.","The staff could not have been better. They are there for you 24/7 without ever being stuffy or overbearing. The hotel and its location is fabulous, not to mention ornate and beautiful and the food was outstanding.","Palm Beach Gardens, Florida",5/22/2018
Corinthia Hotel London,5,Afternoon tea,"faultless,we loved it ,this afternoon tea is the best I've had in London,eight to date. | Service perfect,no rush,nothing was too much trouble,food tasted lovely,staff friendly and we stayed to have a lovely cocktail in the bar afterwards.one regret we were too full to eat anything off the extensive menu but next time plan to go for a meal.","London, United Kingdom",7/11/2015
The Dorchester,2,Didn't live up to expectation,"Having stayed once before was looking forward to a three night stay in a junior suite, booked direct with hotel. | Helpful, courteous pick up at airport from an early morning flight. Was informed at check in that the room type we had booked was not yet ready, hardly surprising as it was still only 0800. We were offered a ""very nice superior room"" as being available immediately. having slept adequately in overnight first on TG and being keen to get out and explore we were happy to wait for the junior suite to become ready later in the day. I wasn't given any other information on the room we were being offered to know whether to accept it or not and was concerned not to end up paying for a basic room when i had booked a ""junior suite"". | What a mistake! The ""suite"" was adjacent to intrusive AC compressors, and was best described as low ceilinged council house 1980s chic overlooking more of the same - think Peabody trust without the altrusitic pricing structure. Lots of swaggy curtains, yet nowhere to unpack a suitcase and a Holiday Inn style bathroom with a marble tiled makeover. Except the shower screen din't fit and meant the bathroom floor was drenched whenever one showered. | Despite assurances that our luggage would be in the room when we returned at 2.30 pm, it wasn't. The receptionist who escorted us to the room assured me he would arrange for it immediately once the oversight was realised. I imagine he forgot. 20 minutes later I called the bell desk, the luggage arrived about 10 minutes later. | We decided to freshen up before dinner with a steam to sweat out 11 hours of flying. The spa / steam room was closed for renovation. I was starting to get a bit tetchy by this stage, but the concierge was helpful and arranged for us to use the steam room at the Park Lane Hilton. That, followed by a pint in Shepherds Market, made me realise that there were numerous alternative hotels that would work for us and offering better value too. On our return I informed the receptionist that we planned to check out early. She helpfully informed me that we had already been given a room upgrade and that there was nothing to be done. I'd hoped for service - not freebie upgrades. Shame. | We returned to the room just after 8pm. It hadn't been made up. | I called the Duty Manager, more to vent frustration at the P--- poor service and VFM that the Dorchester was peddling. To his credit he seemed concerned and to want to make a difference. He asked what he could do to make amends. Having irretrievably lost faith in the Dorchester's ability to deliver service or value it might have helped more if he could have suggested something himself. In my jetlagged state I could only suggest he made sure our revised check out date was noted by reception so that I could move to a hotel that ""did what it says on the tin"". | A bill of around 800 pounds for an overnight stay was presented in the morning. We moved to the Park Lane Sheraton, which promises rather less but delivered substantially more - at half the price. | The positives? Breakfast is pretty good. Should be at 35 pounds or so, but I don't begrudge paying for quality. | Sadly, the rest of our Dorchester ""experience"" fell shamefully short.","Istanbul, Turkey",3/16/2009
The Lanesborough,5,An afternoon in High Society,"My wife and I stopped by on a cool, cloudy Spring afternoon to relax and warm up. She stayed at the Lanesborough a couple of years ago just before the hotel was remodeled and wanted to show me the changes. We were treated like royalty in the Library Bar where Benoit served us perfectly! We enjoyed a couple of cocktails and some snacks while perusing a book Benoit loaned us detailing all the remarkable renovations performed on this magnificent Hotel. Even though we didn't spend the night this time, it's on our list for a future visit.","Seattle, Washington",3/29/2016
The Dorchester,5,End of succesful business year and end of year meeting,"My colleague &amp; I had a meeting to set limits for quarter one 2016 so he was bringing his partner so I did same to let them xmas shop whilst we had meeting. Booked The Dorchester as a luxury treat. Really not disappointed, fabulous experience, everyone very polite and service exceptional, room was superb. Yes, top end hotel but very worthwhile albeit your credit card suffers but you really enjoy. The first evening I met up with my daughter at Le Caprice but second night had dinner with my colleague and partners at the Dorchesters in house 3 star Michelin resturtant. OMG 4 x taster menus, it was sublime, table booked 6.30 and when we arrived it did not seem busy but that had changed by 7.30 so really pleased we sampled this feast of extravagence. ""The starter of pink champagne"" set the tone for the girls for the evening adding extra luxurious costs but certainly an evening a stay to remember.","Norwich, United Kingdom",1/30/2016
Corinthia Hotel London,5,Best Hotel in London! Your Expectations will be Exceeded at Every Turn!,"This property will blow you away! It's beautiful, well appointed, and the staff is top notch. From the hundreds of vases of fresh cut flowers everyday in the lobby and in the room to the modern and well appointed gym, you can't beat this hotel in London. It's the small details they get right-like reaching out to us via e-mail to see if there was anything we needed before we checked in, the healthy treats in the fridge at the gym, the bowl of fresh fruit in the room, the seamless interior decorating of the room, built-in US/Euro outlets, and the amazing turn down service. Even the breakfast that's included which you can order a la carte without issues!",NA,1/31/2016
Mondrian London at Sea Containers,5,Another great stay at the Mondrian London! No doubt ill be down there again soon!,"I'm always happy to stay at the Mondrian London, the location is great, the service is excellent and the bars and restaurant are class! | Unfortunately on this occasion the Rumpus Rooms was closed for a private function but the bar on the ground floor was open and it has a really nice atmosphere. On check in I was provided a free complimentary upgrade as I was a returning customer which was a great touch. | Overall a great place to stay in a couple or a group of friend heading out on the sauce !",Sheffield,1/3/2018
Mondrian London at Sea Containers,5,Best hotel experience ever!,"My boyfriend and I had an incredible stay here! The service was incredible, from the front desk staff to the bellman, to the restaurant staff. Our room was great, and the bed was extremely comfortable. I never want to stay anywhere else in London!","Orlando, Florida",8/25/2017
Mondrian London at Sea Containers,4,My husbands birthday,I stayed here with my husband for his birthday - it is a very busy hotel and has a good vibe! | The rooms are well equipped and nicely designed and great for an overnight stay! I don’t find you get treated like a resident though.... the Bar man in the restaurant was rude when we wanted to get a drink and I didn’t find the drinks very well presented for a hotel of this type! Big thick glasses for gin and vodka and no garnish!! | Also we went up to the rumpus room and just got a table for 45 mind - again no preferential treatment for stayed in the hotel!,"Hitchin, United Kingdom",11/18/2017
Mondrian London at Sea Containers,5,Amazing!,"The hotel was beautifully decorated, very clean, great location and just all around amazing but what made this hotel special was the service. | The front desk staff and concierge service were both extremely helpful. The front staff desk went out of their way to resolve a family issue (i.e. concerned parents calling to check on us) which was very comforting. The concierge service was also very helpful in finding and reserving local restaurants. They were great. | The hotel is one of the nicest hotels I stayed in. Just a real clean, modern, trendy looking design that also has a lot of character to it. I would highly recommend the hotel bar (which isn't your typical hotel bar), where we got some of the best drinks in London. The atmosphere and design was fantastic. The hotel restaurant we ate at was also very good too (if you need a quick bite to eat). | The rooms were very nice, clean and the bed was very comfy. It was a perfect room for travelers looking to rest after a long day of exploring. | What was best about this hotel was the location. It is right in the center of everything you need to do in London. All the big tourist attractions are all within a mile or so and walking distance. What was even better was the train stop, for both local traffic and airport traffic, was RIGHT next to the hotel (10 minute walk with luggage). If you're looking to get around London, the tube is a great way to do that. The tube stop is a 10 minute walk too. | Overall just a great, great experience. Would highly recommend.","Columbus, Ohio",12/17/2015
The Savoy,5,Realising a dream,"As a child my wife passed the hotel every weekend on way to hospital wishing she was going to the savoy instead. 40 years later she was able to stop and go in to make the dream a reality. Sometimes when you want something so much it fails to live up to expectations. Well I'm glad to say this well and truly surpassed all expectations. | We stayed on a dinner bed and breakfast deal. From our arrival to departure everything was perfect. The welcome and assistance from staff was first rate. Despite working hard and sometimes for demanding people their politeness and cheerfulness was a credit to the company. | The room was excellent and extremely well appointed. The bed as comfortable as can be. The shower was like sitting under a hot Victoria falls. Dinner at Kaspars was extra special being seated by the window, a birthday treat in itself. The food was sublime. | Thanks to the bed we nearly missed breakfast, which was way too much but I gave it a good go. | A lot of what I say people may think it should be as a matter of course but you feel the people really do go the extra mile for you. | I'm shocked when I see some poor reviews. I cannot comment on other people's experiences but do wonder about the legitimacy and motivation when I have experienced such excellent treatment. As a disabled guest I'd like to state their treatment of my wife was faultless. I have seen a report slating their lack of disability awareness. This could not be further from the truth. I can only imagine it was not obvious that someone could not do the stairs to Kaspars and they certainly could not have told the staff because they are only too willing to show you to the restaurant, on a route bypassing the steps. | Considering the history the stories the guests that have stayed, I consider it a privilege to have spent a night at London's top hotel",london,2/16/2014
The Dorchester,5,Valentine's day stay,"arrived at the Dorchester hotel around 1pm. check-in was smooth, polite and let us have our room early. | the room was done out in a classic luxuary style... | we enjoyed drinks at the bar in the evening and the waiter was very friendly. | breakfast in the morning was beautiful at the grill. | only minor thing was that I found the room heating and water temperature a little erratic. | all in all very lovely stay.","London, United Kingdom",2/15/2018
The Rembrandt,4,Very nice AFTER we changed rooms,"When we first arrived we were given a very small, fusty room, into which there wasn't even enough room for our suitcases. When we complained (we were booked for an executive room), we were informed that we shouldn't have booked through Expedia and that the room couldn't be changed. We were quite insistent and finally moved into room 450, which was roomier although quite dated. However, the room turned out to be comfortable, and we thought the breakfast was more than adequate. As others have mentioned, the location is superb. My special local treat was the cappuccino and macaroons at Paul near the tube station.",nyc,12/25/2012
"Hotel Xenia, Autograph Collection",5,1 Night Romantic Stay,"This hotel exceeded expectations, we upgraded to the the Executive room, which was not much more and well worth it. We had a lovely room, very clean and a great little balcony (room 105). It was very quiet, close to Earls Court tube. The staff were so friendly and the concierge was really helpful. A great hotel for a nice night away and I think very reasonably priced !","Brighton, United Kingdom",10/30/2014
The Savoy,5,Personal Service Perfection,"On our way to Oxford for the week, my daughter and I made a day/night stop in London. She was attending a conference and I tagged along; London was a mere stopover for dinner and a play and The Savoy is my new favorite place! My daughter’s birthday was our lone day and the hotel made it aware so at tea, dinner (The Savoy Grill) everyone made a point to tell her happy birthday. From the moment we arrived until we left the staff were first rate. Tea was wonderful but the breakfast is the best and would strongly recommend if staying to include this in your stay. Very few hotels have excellent coffee and when you have just come off an international flight, good coffee is a must. The only disappointment was the Grill. It was very good; not excellent.","Alexandria, Louisiana",3/15/2018
A To Z Hotel,2,Interesting,Very friendly. Bedding was clean. Situated in good location. Hard to park car if it was busy. | Breakfast was cup of tea or coffee and toast...don't expect full English if going to book.. | Room was not ready.,"Kingston-upon-Hull, United Kingdom",8/30/2016
Corinthia Hotel London,5,excellent hotel,"I absolutely loved this hotel. The attention to detail is meticulous and deeply satisfying. The rooms are gorgeous, the bed is heavenly and the employees are very helpful and friendly. The food is A+ and the Spa is fabulous. Definately going back to Corinthia Hotel when I'm in London next.","Zurich, Switzerland",12/2/2014
The Dorchester,5,Second home,"Literally when I go back to the Dorchester i feel like going to my second home! | The hospitality the type of rooms and the service I get I feel like I’m in my second home ! | Except to my last visit I was a bit surprise ! With the quality of service I started getting, I was surprised that twice during my 2 weeks stay the room service forget to clean my room while I was out for 8hours! | And I had to raise the issue until they started taking care of my room. Bare in mind I’m a regular customer who stays in the hotel twice yearly. | More so an incident happened with the Concierge as I was trying to book at fire chilter place and he was claiming that their phone is not working! While I was standing in front of him I managed to call and made the reservation on the spot I was a bit surprised with the level of service I used to get and the last visit.!",NA,12/23/2017
"Mandarin Oriental Hyde Park, London",3,Hmmm...,"I stayed here on a business trip. First impressions were not great as the doorman was nowhere in sight when my cab arrived so i lugged my bag in myself. While some people might like the fact that the reception person comes with you to your room to get the forms signed etc (I presume this is usual?) i didn't. A nice touch though was that a complimentary tray of coffee and biscuits was sent to the room after my arrival (which had been early morning following an overnight flight). | I found the room somewhat stuffy - i usually like a classical theme but it somehow didn't work for me. I had no view of anything except concrete, and I didn't like the fact that I didn't have a separate shower. There was also a lot of noise from the passage. On the other hand, the amenities were good, i liked the complimentary bottles of water and apple juice, toiletry/vanity stuff of expected quality etc. | All in all I had a pleasant enough stay here, but felt it didn't quite live up to what I would have expected - the Mandarin in NYC was much nicer I thought.",SA,10/27/2007
Mondrian London at Sea Containers,5,"Awesome location, super cool property","I definitely recommend a stay at the new Mondrian in London. It's very well located in the city. It's proximity to the path along the river makes it easy to get just about anywhere in central London. The staff was extremely friendly and knowledgable. The lobby has a relaxed, cool vibe - perfect for relaxing, having a drink and watching people walk by along the riverfront. The rooms are big and comfortable and come with quality amenities.","Culver City, California",1/19/2015
Apex London Wall Hotel,5,A Real Pleasure................................,"We booked this hotel through The Daily Telegraph 'hand picked' travel section, so a very good price for a London hotel but it far exceeded our expectations. The staff are exceptional - immaculately turned out, friendly, professional and so helpful, nothing was too much trouble - is this thanks to 'in house' training? if so, well done! - you should start a training scheme for other hotels. A special mention for Daniel who was an absolute star - a young man who surely must go far in the hospitality business. | This hotel is about 5 minutes walk from Moorgate station, in the business area, so very quiet at weekends, which is great for a peaceful nights sleep but if its night life you want then you will have to travel a little - it suited us fine. | The rooms are superb - very comfortable, beautifully designed and furnished, modern with co-ordinated bed linens and curtains - all top quality. There is also a lovely flat screen TV mounted on the wall and a Bose I-pod stand. A well stocked mini-bar but prices rather steep - £17.50 for a half bottle of fairly ordinary wine, £3.50 for a small can of tonic etc - I'm sure more people would avail themselves of hotel mini- bars if the prices were a little more realistic - but not a major gripe. There is also a very simple to operate safe in the built in wardrobes. The room had AC but operated very quietly. | The good sized, very modern bathroom is a delight, with a separate bath and walk-in shower, fluffy towels and a lovely selection of Elemis toiletries, plus of course the Apex duck. Dressing gowns were also provided but we did not use them. | Our room on the 4th floor overlooked the road where a building opposite is being renovated but due for completion fairly soon but any work certainly did not disturb us. | The public rooms and restaurant are lovely - one of the nicest restaurants we have been to in any London hotel. The tables in the restaurant are set into 'mini -rooms' so give a much more intimate feel to the dining experience and each large window facing the street has a bowl of beautiful white orchids - indeed each table has a very simple but stunning contemporary flower | arrangement as do all the tables in the bar, which presumably are changed on a regular basis as they looked so fresh - a lovely touch which just added to the whole look of the rooms. We also liked the lighting - enough for you to see exactly what you are doing but subdued enough to create a good ambiance. | The food itself is excellent. There is a superb choice at breakfast catering for all tastes which is served at your table - no buffet breakfast here where food has sat for ages and been picked over- my fruit platter was beautifully served as was the 'full English'. Only complaint? the tea is a bit weak - for the size of pot it really does need at least two tea bags!! | We also ate in the Restaurant for 2 of our evening meals and the experience was just as good - not the widest choice in the world but again beautifully served. Service was very good, staff attentive without being intrusive and we felt the menu offered good value for money. After a day trudging round London it was good to come back to the hotel, shower and know that all we had to do to eat was go downstairs. | All in all a wonderful experience in a most comfortable hotel, within easy reach of the underground and main line stations. Most certainly we would recommend it to others and most certainly, if we see it at the right price, it would be our hotel of choice for visiting London, so many, many thanks to all those who work so hard, front of house, house-keeping etc to make it such a lovely hotel - it was a real pleasure to stay there.",Lancashire,9/5/2012
The Savoy,5,Where life-long memories are made,"For me, the London Savoy is the best hotel in the world. Not only is it in the absolute heart of the worlds most fabulous city, but everywhere you would want to go is just a pleasant walk away. | The hotel leaves absolutely no detail left to chance. The stunning Art Deco features extend from the rooms down to the cutlery and glassware, complemented by Edwardian counterparts depending on the room you're in. Everything here is substantial and genuine; no imitations in sight. | Perfect food and drink, service, comfort, cleanliness and overflowing with proper style. | Our second stay here ends today, and we are truly sad to be leaving, but looking forward to our next visit with anticipation of more of the very best. | The only thing that disappoints us at times is some of the other guests. Respect this iconic establishment if you choose to stay here. Dress and behave appropriately, or stay elsewhere!",Ipswich,5/25/2015
Corinthia Hotel London,5,Return visit - didn't disappoint,"Returned to the Corinthia for the second time last weekend and had another great stay. The hotel is special in every way. We were looked after extremely well and the staff were, once again, excellent.",cambridge,4/22/2013
