45 Park Lane - Dorchester Collection,5,Worth a visit,"We had four nights in a Studio Suite with a view of Hyde Park and it was 95% perfect which is good enough to give value for money. | The location is fine, the sound insulation is adequate and the overall standard of service is acceptable. | We are not the most demanding of guests but we do like to have permanent tea making facilities ie kettle, pot, cups, fresh milk, sugar and of course teabags available permanently. For some reason most hotels fail to get this right. Messages do not get passed on so what sounds an easily achievable task is let down by a slack attitude. | Over the 4 nights we were left with unwashed crockery and items not refreshed on 3 occasions. I know it isn't a tragedy but when a hotel wants to be classed amongst the finest then this should not be a problem! Our host laughed when I challenged her to get it right for the duration of our stay, first day - no teapot! | All in all, a good hotel but not excellent.","Brighton, United Kingdom",8/10/2016
Mondrian London at Sea Containers,5,Perfect City Hotel with Fab Design,"Great stay - comfortable but cool room, delicious food and drinks, friendly and helpful staff (except the girl on the door of the rumpus room but there is always one...) . Only regret is not trying the spa - next time.","London, United Kingdom",12/29/2015
The Savoy,2,Why do pompous?,My wife and I had a reservation for the savoy grill but had an hour to fill prior to sitting down for lunch. We decided on a coffee and approached the cafe manager for a table to be told that she was very sorry but they needed all the tables because they were to start afternoon teas service in 15 minutes. There were no patrons in the cafe at the time. Quite extraordinary. Sometimes I think the superior attitude of some staff at prestigious establishments needs to be adjusted. It was far more important for the manager to have a precise change over in service than to be of service to a customer. Oh well. The grill was good!,"London, United Kingdom",12/18/2014
The Dorchester,5,High Tea im Dorchester – ein Höhepunkt bei jeder Englandreise,"Das Hotel Dorchester in der Park Lane am Hyde Park ist eines der elegantesten Hotels Londons, viele sagen, es ist eindeutig das beste. High Tea, für den es täglich mehrere Termine von 14 Uhr bis 17:30 Uhr gibt, ist ein besonderes Ereignis, da Qualität und Ambiente einzigartig sind. Eine Buchung wird sowohl per SMS auf das Mobiltelefon als auch per e-mail bestätigt und es ist ratsam, lange vor dem geplanten Termin zu reservieren. Die Eleganz der „Promenade“, wie die exquisite Lounge des Dorchester heißt, wo High Tea serviert wird, ist unübertrefflich. Kleine Sitzgruppen in großzügigem Abstand gewährleisten private Sphäre und Raum für entspannte Gespräche im Geschäftsbereich oder auf privater Ebene. Dezente Klaviermusik gibt der Atmosphäre auch eine akustische Note. Ein Beispiel der angebotenen High Tea - Varianten: der „Champagne Afternoon Tea.“, der in mehreren Gängen serviert wird. Es beginnt mit einem Glas Laurent-Perrier NV Champagne und einer Auswahl hochwertiger Sandwiches: “Cucumber with cream cheese on caraway seed bread, Egg mayonnaise with shiso cress on white bread, Chicken with wholegrain mustard mayonnaise on basil bread, Smoked salmon on granary bread”, gefolgt von: “Warm raisin and plain scones served with homemade strawberry jam, a seasonal jam and Cornish clotted cream”, wieder gefolgt von einer Auswahl an French pastries, alles begleitet vom wichtigsten, einer Auswahl an speziell ausgewählten seltenen Teesorten, unter denen man wählen kann. Schließlich sorgt ein perfekter Service, dezent, schnell und freundlich für ein absolutes Wohlgefühl beim Genießen dieses klassischen High Tea.","Vienna, Austria",11/18/2014
Mondrian London at Sea Containers,5,Stunning London Hotel Mondrian with the personal touch,"My wife Rachael and I stayed at the Mondrian on Saturday 9th July for our anniversary and it was a wonderful stay. We arrived in the stunning lobby which is based upon the great transatlantic liners of the twenties with a huge hull curving around the from reception to the restaurant made from copper panels riveted together and cool Barcelona style furniture. We were greeted by Jessica on reception who made us feel truly special and welcome, she asked if it was a special occasion and when we said it was our anniversary she called over the manager who allocated us a fantastic 11th floor room with views of the Thames, St Pauls etc.It was such a refreshing change to be treated so personally in a London hotel ,a great start. | Our room was lovely ,spacious, beautifully finished, with a luxurious marble shower room, full media connectivity and a very comfortable bed. | On Jessica's recommendation we tried the Dandilyan cocktail bar on the ground floor for marvellous cocktails and later the amazing skyline bar Rumpus Room on the 12th floor with incredible views across the city and a very chilled vibe. | In the morning we went to breakfast where you can choose to eat inside or outside on the riverside terrace, it was the best breakfast buffet we have enjoyed in any London hotel with everything you can imagine laid out and cooked to perfection. | The location of the hotel is excellent on the Southbank in easy walking distance of the OXO tower, Festival Hall, National Theatre, Globe theatre. | We will definitely be staying at the Mondrian again soon and would like to thank everyone there for such great service , especially Jessica for looking after us so well upon arrival.",Broadstone,7/12/2016
A To Z Hotel,2,"Filthy, Unhygienic",This hotel is not at all good value for money. It is very filthy and unhygienic. There was no working TV as advertised and the noise level is too high for someone to get some rest. the bed sheets are not that clean. I will never recommend this hotel again for the money paid.,"London, United Kingdom",2/16/2016
"Mandarin Oriental Hyde Park, London",5,Love this place,"I love this place, the feeling of being somewhere special starts as soon as you clap eyes on the place. Staff are so attentive - without being in your face - from the door being opened by a smiling face with a big red coat (So English!), to the Floor Managers that look after everything you could possibly think of. The spa is heavenly (Very Zen!), the bar is rocking and the restaurants are serene places quietly dishing up the best of the best - lots of organic! Splash out and go for a Hyde Park view, you'll be one of very view with access to such a stunning sight as soon as you open your eyes after a good nights sleep - pure Irish linen sheets - the ultimate indulgence! | I've stayed in 5 star hotels all over the world but Mandarin Orientals really are my favourite.",Melbourne,12/14/2004
The Savoy,5,American Bar review,Tons of alcoholic choices to your heart's (or liver's) content with a great level of service that is both warm and welcoming. They have a pianist for easy listening entertainment. It was a great way to conclude my trip in London.,"Los Angeles, California",9/12/2014
The Savoy,5,Beautiful,"World class, not much else to say. Exactly what you could have hoped for. Just do it. Great little chocolate shop just off the foyer and 5 seconds away from the savoy theatre. Stayed for 2 nights and was looked after endlessly by a truly committed group","Basingstoke, United Kingdom",10/9/2014
The Rembrandt,3,Great location,"We stayed there for 9 nights. We arrived early in the morning to get our room as we booked an early check in at 10 am. However, the room wasn't available but nice Tina at the reception desk compensate us with an upgrade from superior to executive. The rest of the reception staff are not pleasent to deal with them. The room was clean but a major con that the walls are thin. The breakfast staff are efficient and the breakfast was great. Room 257.",NA,8/8/2011
The Savoy,5,<U+670D><U+52D9><U+4E00><U+6D41>,"<U+9019><U+662F><U+6211><U+5011><U+5728><U+502B><U+6566><U+7B2C><U+4E8C><U+9593><U+5165><U+4F4F><U+7684><U+9152><U+5E97><U+3002><U+76F8><U+6BD4><U+8D77><U+7B2C><U+4E00><U+9593><U+9152><U+5E97>,<U+9019><U+9593><U+9152><U+5E97><U+7684><U+8A2D><U+65BD><U+548C><U+670D><U+52D9><U+4E5F><U+662F><U+9060><U+9060><U+6BD4><U+8F03><U+597D><U+7684><U+3002><U+6211><U+548C><U+670B><U+53CB><U+5011><U+90FD><U+5341><U+5206><U+4EAB><U+53D7><U+9019><U+9593><U+9152><U+5E97><U+63D0><U+4F9B><U+7684><U+670D><U+52D9>,<U+6703><U+518D><U+6B21><U+5165><U+4F4F><U+3002>","Hong Kong, China",7/1/2018
Apex London Wall Hotel,4,Excellent!,"We loved staying at the Apex on New Years. The service was as good as you would expect from a 4 star hotel, even allowing a late checkout free of charge. The facilities were absolutely excellent and the whole room layout was just great! Not to mention the free rubber duck, jelly beans, pringles and mineral water :) Would definitely recommend to anyone!","Hatfield, United Kingdom",1/30/2012
Apex London Wall Hotel,5,Beautiful hotel and excellent service,"Really happy with the stay - the hotel is amazing, especially after the previous night in a Travelodge. | The staff were extremely friendly, helpful and professional. The room was gorgeous, clean and there were some lovely extras such as snacks, dressing robes and slippers. | We had one issue with the breakfast - overcooked boiled eggs that came to our room in the morning, but the staff kindly didn't charge us for this after we mentioned it. So I can't fault them really. | Highly recommend this. Look forward to visiting again.",Edinburgh,2/1/2012
The Rembrandt,4,Carino,"Siamo stati in questo hotel per 4 giorni a cavallo di Natale e l'ultimo dell'anno. Hotel in posizione poco distante dal centro e pur non potendoci arrivare a piedi non ci siamo però svenati con i Taxi. La struttura è quella classica degli hotel di città , un pochino datato ma comunque carino e ben tenuto. Purtroppo il personale non parla assolutamente la nostra lingua ma é stato molto cordiale nel cercare di capire le nostre richieste. Camere ben tenute e pulite con riassetto giornaliero. Colazione a buffet abbondante , buona e con tanta scelta. Non abbiamo mai provato il ristorante essendo fuori tutto il giorno e ci siamo accontentati del servizio al bar che é comunque risultato di buona fattura fornendo una buona disponibilità di bevande e snack (pizza , panini , sandwich e addirittura la pasta) con orari molto ampi di apertura. Wi-Fi gratis in tutto l'albergo molto veloce. Esperienza positiva che consigliamo a chi non ha esigenze molto elevate e si accontenta della normalità quotidiana. Camere dotate di tutti i confort base : TV , cassaforte , asciugacapelli e bagno di media grandezza. Giudizio quindi positivo.","Vimercate, Italy",1/1/2016
"Hotel Xenia, Autograph Collection",3,I tried to like it...,"Great location between two different tube lines, next to a grocery store with a Starbucks. The hotel is very clean, and staff very courteous. My room was unbelievably small for the equivalent of $220 USD, so small that I didn't want housekeeping in because I'd have to repack for anyone but me to enter! Barely room for luggage rack, which I had to request. They have a mat on the bed that says ""luggage here,"" however, I don't like sleeping with my suitcase. Breakfast chintzy, so I ate next door at Starbucks in the grocery store. I love Marriotts and have had good luck with Autograph Collection, but won't stay here again.","Westport Point, Massachusetts",6/16/2017
Ridgemount Hotel,5,"gut, sauber, freundlich - ideal für Kurztrips","Wir haben bei Ryanair einen günstigen Flug von Bremen nach London ""geschossen"" und sind eine Nacht im Ridgemount eingekehrt. | Die Wahl haben wir nicht bereut. | Wir hatten ein geräumiges Doppelzimmer mit Bad, Dusche, WC, TV und Frühstück. | Alles sehr sauber und ordentlich. | Preis mit allem drum und dran 80 Pfund! | Das Beste an dem Hotel ist die perfekte Lage. | Man kann von dort aus zu Fuss London erkunden, vor der Tür halten mehrere Busse und um die Ecke ist eine U-Bahn-Station. | Wer einen Kurztrip nach London plant sollte dieses Hotel auf jeden Fall in Betracht ziehen.","Oldenburg, Germany",11/10/2010
The Rembrandt,5,ponte immacolata,"hotel elegante in zona centrale con camere spaziose, breakfast ottimo e vario. staff molto disponibile e gentile. vicino all'hotel musei e metro e grandi magazzini . zona vivace e giovane. ci tornero' sicuramente ancora",milano,3/4/2017
Corinthia Hotel London,5,A wonderful experience.,When visiting London take my advice and stay at the Corinthia.This hotel is a dream come true.I could not fault it in any way.Whoever designed the rooms is a genius or someone who has travelled a lot as the design and accessories are more than perfect.One could go on and on with praising this hotel and as for me I can't wait to return.,"Valletta, Malta",12/3/2014
The Dorchester,4,Beautiful classic hotel,"Such an iconic place, you couldn't but enjoy a stay here. Great location. I am not sure if we'll be back though and I docked a mark as I felt it could do with a little upgrade and it doesn't have a bar to have a few drinks in. We were with 2 other couples and wanted to just chill and chat somewhere when we came back to the hotel but there was nowhere to go. | Service and staff cannot be faulted in any way. They are pleasant, polite and could not do enough for you.",sligo,8/7/2018
Corinthia Hotel London,5,Alto livello,"Siamo stati 2 notti in famiglia (con 2 bimbi piccoli). Hotel di lusso, alto livello in tutto. Ambienti suntuosi. Moderno. Camere ampie e pulite. Posizione ottima..! SPA fantastica con accesso alla piscina anche per i più piccoli.. Colazione di buon livello. Personale cordiale. Prezzi alti (ma Londra è così..). Ci voglio tornare.",NA,9/5/2016
The Savoy,5,Amazing evening with old friends at The Savoy,"We had an excellent, spoily experience at The Savoy last week - we had superb attentive service in The Knights Bar before going to Kaspar for a delicious dinner with unforgettable cocktails from The Beaufort Bar at the end of the evening - truly amazing. The Savoy is a stunning hotel with beautiful facilities and delightful unassuming service - we will definitely return !","London, United Kingdom",8/3/2017
Mondrian London at Sea Containers,5,Best Deep Tissue massage in London at the Agua Spa at the Mondrian Hotel,"Best Deep Tissue massage in London at the Agua Spa at the Mondrian Hotel. Great spa area, lovely chill out room and also the steam room, but the massage from Trillian was out of this world. Highly recommend, worth going out of your way for","High Wycombe, United Kingdom",6/28/2016
Rhodes Hotel,5,The perfect place if you want to start your stay in London,"A very pleasant hotel. The rooms are very clean and tidy. It's close to Paddington station wich it makes it fantastic. Many amenities around the hotel. Very close to Hyde Park, wich makes it perfect for summer festivals.",London,3/1/2013
The Savoy,4,Choose an Art Deco room for sure...,"My girlfriend treated me to a stay at The Savoy, and it was unforgettable. I work in the industry at a neighbouring 5* hotel so was interested to see how elegant the service and property really was after its £100m refurbishment. I was not disappointed. | The locations is brilliant for the theatre land (West End) but not that great for shopping. Knightsbridge is far better - which is a 15 minute taxi to the west of the hotel. | The lobby area is tidy and well run and you can immediately tell you have entered a smooth operation with smiling but efficient staff. The rooms are either modern or art deco, and fortunately we were upgraded into an art deco suite which was spectacular. It was not overly large or lavish, but a perfect mix of style, comfort and usability. There were no silly additional things like fancy light switches that also control the television etc.... instead there was a normal one, and a normal remote which everyone could use immediately. We enjoyed the large selection of music available for free on the TV and you can 'pipe' music through to the sitting room, or your bathroom which was fun. | If you get a suite then you are offered a butler who will do just about anything... we had our shoes polished, some clothes ironed, and she bought us a set of London monopoly too at our request - from the order we had it up in our room in just under one hour. | The American Bar is pretty trendy, although I prefer the Beaufort Bar with its very high ceiling and old fashioned style. Either one serve lovely cocktails as you'd expect - although expect to pay around £15 - £20. The River Restaurant is good, although perhaps not as good as it ought to be. I dined with friends and all our food was well presented and yummy, but none of us said we would return since it was about £85 a head... we would return to the Beaufort Bar however - great people watching! | In the morning we had a delicious breakfast in the room which was served piping hot and very quickly. Upon check-out I asked for a quick show-round and saw some of the smaller rooms, along with their amazing suites. I would absolutely definitely 100% only book an art deco room - although the modern rooms are ok, the difference is huge. I stay at hotels to experience something different from home... so why pay £1,000 to stay in a modern room which does not fit with the hotel, when you can stay in a traditional art deco room that fits with the whole atmosphere of the hotel and its service. | If you like London hotels, this is a classic which you ought to experience once... but if you can't afford to, then I'd suggest popping into the Beaufort Bar for a cocktail.",London,2/4/2012
The Dorchester,5,Top stay,"The Dorchester, | Maybe i have been extremely lucky but when looking for a hotel in London, close to the area where i had to attend a dinner, i came across 'The Dorchester'. | Having heard a lot about 'The Dorchester ', they happened to have a promotion in February and could book a single room at £200 (excl taxes, 15%), which for London standards is very, very good price for a hotel with that class. | The reception was rather cool, but the good news was that for one or the other reason i got 'an upgrade'. Frankly speaking when booking i thought i would get an overpriced,small, crampy London hotel room but all of a sudden i found myself in a very nice luxury top class room with marble bathroom. | During my stay i had nothing to complain and treated myself the next morning with an (overpriced) Englisk breakfast, but all in all a lovery experience. | Thanks Dorchester, a stay to remember...",Aartselaar,3/12/2008
The Rembrandt,5,"Location, room, and service outstanding","The location across from V&amp;A and near Kensington tube is outstanding. Ask for executive room as it and bathroom is large and spotless. Rm 649 offered a partial V&amp;A view, quiet, and nice big, comfy bed. Concierge, Pablo, was friendly, informative and extremely helpful. A description falls between a boutique hotel and a large hotel. All the romance of a boutique with the services of a grand hotel. Compared to others, it is a fantastic value when buffet breakfast is included. Staff at buffet greeted us with a smile every morning. We booked thru booking.com, then needed a change, emailed the hotel direct, hotel accommodated us graciously. Lovely staff.",NA,8/17/2015
Ridgemount Hotel,4,overnight stay,"Very very clean B+B, very helpful and informative staff. Easy walking distance of Covent Gardens. Small rooms and hard beds but en-suite adequate. Tea and coffee available from a machine downstairs.Great breakfast . Only downside is the busy main road at the front which our room overlooked. Perhaps a room at the back would cut out some of the noise but hey.....this is London, expect some hussle and noise!! Would definitely go back.",north yorkshire,5/7/2012
Mondrian London at Sea Containers,5,Another great stay!,"My 2nd visit was even lovelier than the first. Superior room with well stocked mini bar, and good facilities. Delicious breakfast in the Sea Containers restaurant, which has fantastic views of St Pauls and the river. Had the Wyld Afternoon Tea in the Dandelyan and it was the best afternoon tea I've ever had - delicious! Lovely friendly and helpful staff. Will hopefully be back for my 3rd visit soon.","London, United Kingdom",8/2/2017
"Hotel Xenia, Autograph Collection",5,Hotel impecável em todos os sentidos.,"Embora os quartos pequenos, camas super confortáveis, roupas de cama ótimas, cobertores feitos a mão, decoração linda, muito limpo, cheiroso, banheiros impecáveis, ameneties l'occitane. Café da manhã super gostoso, muitas opções, Janelas enormes com muitas flores. Perto de metrô, bairro nobre. Perfeito!!!!!","Balneario Camboriu, SC",6/26/2016
"Hotel Xenia, Autograph Collection",5,Top Notch Accommodations in London,"My wife and I recently returned from our four-night stay at Hotel Xenia in London. If we ever return to London, there is a 100% chance that we will try to stay at this hotel again! Our entire experience was exceptional, from the moment we walked in the doors to the moment we checked out. Every member of the hotel staff was friendly and helpful. We felt like family during our stay. The rooms themselves are clean and well-equipped with modern furnishings. I particularly enjoyed the shower with its combination of a rain shower head and removable sprayer! For a luxury hotel, the price for our stay was very affordable as well which was just an added bonus!","Indianapolis, Indiana",7/7/2017
Apex London Wall Hotel,5,un bel hotel,"Arrivé en Eurostar pour découvrir la capital anglaise et un peu pour le travail, nous avons trouvés hôtel est idéal pour les ce type de voyages, belle grandes chambres, un énorme lit et des coussins partout. La belle vue permet de découvrir Londres , hyper équipée la télé moderne, système de musique, clim, mini bar, bouilloire pour le T team avec des encas gratuit, et aussi du le wifi de qualité! . La salle de bain est quasi neuve serviettes peignoirs produit lavant Le personnel est plus qu’aimable, il est au petit soin. Nous avons bien apprécié le bar. Les diner pris au restaurant étaient correct et délicieux. Le petit déjeuner idéal, copieux varié nous a bien cal é pour une bonne partie de la journée",aubusson,9/12/2012
Rhodes Hotel,5,"Super Hotel, unschlagbarer Preis, tolle Lage",Schönes Hotel in einem Altbau in unmittelbarer Nähe zur Tube-Station Lancaster Gate (3 min). Saubere moderne Zimmer mit frisch renovierten Badezimmern. Nettes Personal und für englische Verhältnisse ordentliches Continental Breakfast.,"Bonn, Germany",1/20/2014
Mondrian London at Sea Containers,5,The Mondrian is well worth a visit!,"We routinely stay at St Martins Lane and this was the first time we'd ventured the other side of the river and I have to say it was well worth it. The hotel was first class...we stayed in a River View Balcony suite with a view toward St Pauls Cathedral and it was clean, well maintained and extremely tasteful. It was my Fiancés birthday and the hotel left a handwritten note of congratulations and a bottle of fizz which was an especially nice touch. It was an excellent location for th Oxo Tower, which was the venue for the birthday meal, again a good choice. All in all I have to say....we shall be back!!","Swindon, United Kingdom",7/13/2016
Apex London Wall Hotel,3,Very clean and very friendly though CS sub par.,"If I would to highlight the one best place about this hotel it is that it's far enough away from the main city to be very quiet. The front desk was very friendly and they are all wonderful. I wanted a mini-fridge and was not going to use the mini-bar so they just took out all the alcohol that minute so I could use the fridge. The one night they accidentally did restock the fridge front desk I wish I remembered her name came up right away to take it out and was very apologetic. The rooms are very clean and was restocked daily I even had a complaint about the noise because of the cleaning maids making to much noise to early (and it wasn't their fault the door stop just made a lot of noise) and they adjusted so they would clean that room later so we could sleep in. | The only downsides I could say would be the concierge and the hotel restaurant. In the restaurant you have to (well we had to at least) pay up front 30lbs per person for the meal which is not to pricey as it includes appetizer, main, and desert. I personally did not like anything for an appetizer and my girlfriend did not want desert so I asked if we had to order all 3 courses and could we take some off the tab if we ordered just the main or even replace them with sides (which are not included)? She told me that I could order one course but the price would not change and I wasn't going to pay that much for just one course with no sides at a hotel restaurant. | | On top of that DO YOUR OWN RESEARCH FOR RESTAURANTS! The concierge there was no help I mean he would call places that I found to make reservations for us, but he was just doing Google searches and came up with the same results I did in my room. I wanted to eat off the beaten path and every night he would say ""I do not know look at convent garden"". | (As a side note when we went to 3 cities in Italy every place would recommend places that they would go to eat and out of all the places we only had 1 bad place out of 2 weeks there.) It was very frustrating to find a place as we went during the holidays and every placed was packed. So after a full day (12+hrs) of site-seeing I would have to go back and do research on where to eat for the next day which I wish I really did not have to do.","Coventry, Rhode Island",2/1/2014
