The Savoy,5,"""A big warm hug...""","When you are a young person, and you have to stay inside for years for a disease you didn't asked for, that makes you even more ill. But as i allways say : if you can dream it you can do it! And it helped : hearing from doctors i am getting better which meant i can go outside and going on holliday...wow! | From the moment i heard this, i opened my laptop and booked eurostar tickets to go to one of my favourite cities in the world, london...but this was going to be totally different. I wanted and needed to treat myself, as i didnt had the opportunity the last years to do this. So i went looking for a nice looking hotel, and if possible one with an atmosphere which screams luxury, but the most of all quietness. To much noise or a to busy lobby would make me ill and actually really quickly i ended up with the savoy. Reading the amazing reviews and watching amazing pictures of the hotel wanted me to make a reservation and without thinking to much about the price, i just did it! | And from that moment, i was stepping into a dream. Having really warm conversations trough email with the staff of the hotel ( thank you hannah) for being sure everything would be perfect for by the time i would arrive, this was very promising. I wasn't the most easy guest i think, asking a few requests like having a quiet room, if possible a spacious room and a late checkout as this would only help to make myself stress- free and never the staff reacted as they found this ridiculous. They actually understood how i must be feeling and how important this stay was. | And gosh, my arrival was more then perfect. A lovely doormen, taking directly my suitcases and opening the doors of the hotel to send me to another amazing friendly staffmember who directly welcomed me by saying ""wonderfull to have you here mr. Vermeersch"". A bit tired of my journey, but my excitement helped me trough this and after having a little tour of the hotel, with lots of ""oohs"" and ""woows"" of being overwhelmed, it got even to another higher level of service as they said they would call my butler...""my butler?"" , I said, ""yes, we are delighted to offer you one of our suites"" ...so by the time i arrived at my room, the butler was standing there waiting to give me a tour of the room. While he was going to get some tea, all kind of words kept passing me by : Big, luxurious, detailed,overwhelmed, wonderfull, comfy, ...and what a room! ThEy really helped me with offering this spacious room, as this creates a more relaxing atmosphere , although a standard room would have made me allready happy. So i can't thank the wonderfull staff enough for making my important requests reality. Each second i was enjoying my stay, from going to the public toilets ( where they gave you soap and towels before you were able to get it yourself) to having a nice cocktail in the american bar ( altough the ober didn't want to bring us with 3 persons twice the same cocktail as he found this stupid, he wanted everyone to take an other one...found this a bit rude ) to even the most important and amazing thing : each staffmember you are passing by greeting you with a spontanious and friendly ""hi sir"" or ""how do you do"". | As you can hear, this hotel has everything you want and really made me feel special. At one point i had to pinch myself this was really happening : me having a HOLIDAY, in LONDON, In the SAVOY...without becoming ill ( as i have to watch out) so i can only end up by saying savoy will be a memory i will never forget and even further : it gave me the sparkle again in my eyes i had lost over the past years because of my disease, the sparkle of the happy niek who i was used to be. | So the only way to end properly with this review is by saying : | ""A big warm hug"", that's what i would like to give each staffmember the next time i will be staying here. | Ps : as i must enjoy the fact i'm getting better, that will be sooner then i would have been able to imagine --&gt; you see me back in december gorgeous savoy ;-) | Kindest greets to everyone and thank you ! | Niek vermeersch","Gent, Oost-Vlaanderen, Belgium",8/29/2013
Rhodes Hotel,5,Excelente,"Muy bueno el hotel, nuestro dormitorio estaba en el subsuelo y era súper luminoso. Es excelente el estado de conservación de la habitación. Gracias a la ubicación podíamos ir fácilmente a Windsor. También es excelente el desayuno.","Buenos Aires, Argentina",12/26/2016
The Rembrandt,5,"Comfortable rooms, great position",This hotel was booked at the last minute for a business trip. The rate was very good value for money. The hotel itself is conveniently situated opposite the V&amp;A and Natural History Museum and just a couple of minutes walk from South Kensington tube. Having not stayed in this area for many years it was a pleasant suprise to see all of the beautiful Victorian and Georgian buildings in this area looking so stunning. | The staff were helpful and efficient and check in very quick. My room (a club room) was fantastic.. It looked as though it had hardly been used it was so clean. Enough space to feel comfortable in and well designed furnishings. The bed was as comfortable as any hotel bed I have slept in and the hot air heating was so quiet you could not tell it was on... Such a change from some of the rattling systems that you find even in new hotels. the bathroom was exceptional. Spotless.. a double shower and a jacuzzi bath with showerhead... it felt like home from home.. once again it was so clean it felt like no one had used it before. | Breakfast was tasty and good quality.. the only slight downside was that the breakfast room was packed and the staff were struggling to keep up with the ever growing number of guests. they worked very hard and remained polite but there was sweat rolling down the faces of everyone working there.. not quite what you want to look at first thing in the morning.. Maybe 2 or 3 more serving staff would help.,"Stafford, United Kingdom",12/6/2013
Mondrian London at Sea Containers,4,A stylish hotel with good service and a great location,Stayed here on business for a week. | Room was comfortable and well appointed. | The hotel is a great location to access London and many of the sights. | Service was good. | Hotel breakfast was good quality but there was a limited selection of cooked options available at the buffet and oddly no granular sugar (for cereal) or pepper on the tables. | Perhaps an issue of form over function ! Nonetheless a pleasant stay and would happily stay again.,"Maidenhead, United Kingdom",2/8/2016
The Savoy,1,Ripped Off,The most ridiculous prices for anything over the regular room rate I have ever experienced. I liked the way we were checked in. When we complained about wrongful charges we were treated poorly........,Denver,7/15/2014
The Dorchester,3,Déçue par l'accueil....,"L'afternoon Champagne Tea était bien, rien à dire. Les patisseries excellentes. Le service sympathique. Pourtant l'accueil n'a pas été à la hauteur d'un 5 étoiles. Personne ne nous a débarrassé de nos manteaux..... qui sont restés sur les fauteuils.... Pas très élégants me semble-t-il.....","Quinta do Lago, Portugal",1/21/2017
Corinthia Hotel London,5,Has to be the best in London,"Once you've experienced Corinthia London, there is no going back. After a wonderful stay last June for our Anniversary/Husband's birthday, we simply had to return this year. | Everything I said in my last review still stands: in my opinion, this hotel cannot be beaten. It comes at a price, but we feel that price is worth it for the overall superb experience you receive. It goes way beyond a room for the night for us. The bathroom is a highlight, and I spend as much time as possible in the amazing tub, with TV, whilst sipping on the Champagne that we added onto our booking. The general amenities are also top notch. | We arrived early, but as we had plans did not need access to our room - instead, we said we'd prefer to be able to checkout late the next day after a business lunch in the Northall, which they duly noted. We had been told we'd received a double upgrade to a room on the 6th floor, (upgrades, where available, are one of the benefits when booking directly with the hotel). When we returned that afternoon, we were given a different room on the 7th floor. Not sure what room type it was, and we did miss the larger bed we had last time, but as with all rooms at Cornthia, it was supremely comfortable and this particular one had a view to die for whilst in London, and did allow us the aforementioned late checkout the following afternoon. | We enjoyed the spa, the Bassoon Bar, the Northall - (which is always a highlight for us). The food, ambience and service are perfect in there, and it's always on our if we visit London, even just for the day. | Would we go back? Absolutely: I think it will become a yearly tradition - with more stays in between if time, babysitting Grandparents and funds allow!","Southampton, United Kingdom",8/20/2015
London Guest House,5,Bargain!,"Wanted to take my son to London and do the “tourist thing” but didn’t want to spend a fortune. This little B&amp;B was just the ticket, great price and a fantastic little room. The staff were very friendly, the rooms were well presented, feshly cooked breakfast in the morning, and free off road parking as well!! About a 15 minute walk from Acton tube station, so getting around was really easy too! Couldn’t recommend this place more, if light on the wallet but not a dive is what you’re looking for then this is the place for you.",NA,6/17/2018
"Hotel Xenia, Autograph Collection",5,EXCELLENT PROPERTY,"I was there on business with about 10 other colleagues. I had never been to London and was not sure about location, property, etc. The hotel was awesome and the staff was impeccable! Everyone was so incredibly helpful even with all of my last minute requests. Food and cocktails were great! The location was perfect!!! I will definitely stay there again.","Plano, Texas",3/31/2017
Mondrian London at Sea Containers,2,Is this really a Morgans Hotel?!,"Having stayed at several Morgans Hotels on both sides of the pond, I was really looking forward to checking in to the Mondrian London. | I have to say I was bitterly disappointed and left questioning whether this hotel was actually a Morgans property. | Normally the second you step into any Morgans property, you instantly know you’re in a Morgans Hotel. They always have the wow factor &amp; the décor has such a quirky, distinctive style, and the service is always exemplary without being stuffy. The same cannot be said about Mondrian London- we could have been in any generic high-end hotel in the world, and some of the staff behaviour we witnessed was highly sub-standard. | The room was nice, but nice is not a word I would normally use to describe a Morgans room- it’s usually ‘amazing’, ‘iconic’, incredible’. It was stylish but had no soul &amp; décor wise we could have been in a room in any hotel in the world. However the view of the Thames &amp; St Pauls was fantastic and was a redemptive feature &amp; the large marble bathroom, which is synonymous with Morgans was amazing &amp; without doubt the highlight of the room. | The bed was enormous, but was so hard it was like sleeping on breeze blocks- possibly one of the worst night’s sleep I’ve ever had- had to get up in the night &amp; go &amp; sleep on the couch- not really what you expect from a £500 room. | We had aperitifs in the Dandelyan bar- again the décor is completely unremarkable- nothing special when compared to the likes of the group’s other bars, but was comfortable enough. We had really high hopes for this bar, as it is apparently run by an award winning mixologist, so we couldn’t wait to sample to cocktails- and wait we did- while we pored over the enormous, incomprehensible menu. It was more like a botanical reference book than a cocktail menu- gargantuan in size and too wordy with no comprehensible flow. People know what they like to drink- either in terms of the spirit base of their cocktail (vodka, rum, gin, whiskey), or the type of drink they prefer (martini, flute, long etc..), therefore it is a sensible idea to arrange menus in a way that people can easily access the information they are looking for, as most high end places do. We got so fed up of trying to look for something suitable that we gave up &amp; ordered a glass of Champagne- which was served warm &amp; flat!!!! Quite ironic that these supposed award winning bartenders, weren’t even able to get a glass of Champagne right! But the waitress- not sure of her name, but she was of an eastern heritage- was very welcoming and friendly with a constant smile, so made up for the poor drinks. | We went through to dinner, and it was fantastic, the food was all executed perfectly &amp; really tasty &amp; well presented. Service was also very good, but we found the waiter to be quite formal and stiff which was quite surprising in a Morgans. He was very efficient and slick, but wasn’t very engaging and definitely needed to smile more. The décor of the restaurant was very elegant and had great views across the Thames. There was a clear managerial presence on the floor, which always instils confidence in you as a diner. The Irish manager checked on our table, and the other tables around us, a touch that was very much appreciated. Breakfast was also excellent there. I would wholeheartedly recommend the Sea Containers restaurant, as a stand-alone venue. | We had drinks up at the Rumpus Room &amp; were welcomed by a very colourful character who instantly put a smile on our faces &amp; gave us a very warm welcome (not sure if he was the manager or host- gentleman with a beard &amp; earrings). Again the bar was nice décor wise, it had a classy feel to it &amp; the views across the Thames were spectacular. This time we opted to sit at the bar, so we could speak to the bartenders about the drinks &amp; avoid another negative experience like we had in Dandelyan. We were served by great bartender- can’t recall his name- blue eyed chap who I believe told us he was from Hungary. He was friendly &amp; chatty &amp; made us feel welcome without being intrusive. He made us some bespoke cocktails based on our preferences, which were exquisite. Faith restored, we opted to order the next round from the menu- big mistake- they pre make their cocktails in batches &amp; literally just pour it out of a bottle onto ice!!! You may expect this kind of cutting corners from a high-volume, low-end venue, but we certainly did not expect this from a supposed high-end cocktail bar in a luxury hotel!!!! When you are paying around £15 for a cocktail, plus service charge, you expect your drinks to be freshly made &amp; for there to be a bit more service than simply opening a bottle! I couldn’t believe what I was seeing! The bartender made us some more bespoke cocktails instead, which again were great- if you visit this bar ask for the bartenders to make you something based on your likes &amp; avoid their menu. We moved to a table &amp; had several different waitresses check on us &amp; serve us, all of whom were friendly &amp; attentive. | The ambience was good in the bar &amp; it is great for people watching, but one thing we did notice, which we thought was highly inappropriate was the lady with the short hair &amp; American accent -not sure what her role was but she seemed to work there, as went behind the bar &amp; was talking (well shouting across the room actually) to all the other staff- openly imbibing in the bar! In our experience of high end hotels, the staff don’t normally openly drink to the point of belligerence in front of the guests during hours of service, so we were quite shocked by this &amp; didn’t think having a drunk member of staff on the floor was acceptable. So this &amp; the pre made cocktails let this bar down &amp; clouded our otherwise good experience. | Overall I would say this hotel &amp; its facilities are mediocre at best. They are ok, but when you are paying five star prices, you expect a five star experience. If you are a Morgans aficionado like me, then avoid this place and stay at Sanderson or St Martins Lane instead, where you will receive the full Morgans experience. | But I would certainly recommend the Sea Containers restaurant, excellent food &amp; good service in a beautiful location. | And if you don’t mind a drunken member of staff shouting across the room &amp; having to sit at the bar to order with the bartenders, then I would also recommend Rumpus Room.","London, United Kingdom",6/14/2016
The Lanesborough,5,Perfect tranquility,"Just had a wonderful overnight stay at the Lanesborough and it was wonderful. | The style of the hotel was lovely, we think regency, and so peaceful. | All the staff were attentive but not over the top. From the door men who took our bags from us on arrival (and at midnight when we came back from an event laden down with goodies) to the very friendly receptionist (Jamie or Janie we think her name was) who booked up in before showing us to our room. Then we were greeted by the butler Eve who explained their service which included a complementary clothes pressing if needed (we took advantage as my dress shirt had not travelled well). | We enjoyed lunch at Celeste and several cocktails in the Library Bar. | All in all a wonderful stay, thank you.","Banbury, United Kingdom",10/28/2016
The Rembrandt,5,So happy with The Rembrandt!,"This was my 2nd trip to London. This hotel was excellent! Landed in Heathrow and took the tube right to S. Kensington stop. It was a 5 minute walk to The Rembrandt. Check in was quick and nice. Harrods is a 10 minute walk down the street. Near the tube station there was a cute square with a dozen restaurants and bars. And with the tube so close all of London was at our fingertips. You MUST go to the hotel bar. Excellent service, friendly wait staff. They knew our names after one visit and remembered what we drank. You just go visit them! The daily breakfast that was free was perfect. Just enough choices to hold us over until lunch out. It was a nice addition to our stay. Our phone charger didn't work and the front desk was nice enough to let us borrow one for our trip. The room was cute and clean. Spotless actually. Quiet as well. I literally cannot say anything bad about our stay. I would stay here again in a heartbeat!","New Jersey, United States",4/18/2014
Rhodes Hotel,3,Wait until after Nov 2017,"We booked this hotel in April and visited in late September. The hotel is under remodel- the dining room is closed, there are remodeling supplies all about and the exterior is covered in scaffolding. The breakfast is provided in your room fridge- yogurt, cheese, breads, fruit and tea or coffee. That was actually quite convenient. | The room we had was around the block from the building. There was constant pounding, sanding, banging, singing and cell phone ringing from about 0730 to 1700 each day so don't plan a lie-in or a nap during the day. The receptionist/bell boy/handyman (came to fix our sink drain) said it should be done at November so we'd recommend calling before booking. | All that said, the place was dead silent at night, which was grand, and in a most wonderful spot for touristing. Very close to parks, tubes, Paddington and Oxford Street. | There are so many hotels in this area, we will look at others the next time we visit.","Broomfield, Colorado",10/1/2017
Apex London Wall Hotel,5,Good business hotel in City,"I stayed at the Apex London Wall for one night and it was very good. Helpful service and everything you need for a business stay with complimentary wi-fi and short walk to everything within the City. The room was a bit small, but very comfortable beds and new interior and bathroom facilities. I can recommend this hotel for future guests.","Oslo, Norway",1/8/2013
The Savoy,5,Impecable Service,"Never have I ever stayed in an establishment with so many members of staff so willing to help, and so kind and friendly whilst doing so. I must especially mention Tom at the concierge desk, he went to great lengths to help me plan a lovely weekend of activities for my partner and I. The concierge team are all fabulous, and if you are staying in this wonderful hotel, make sure to make full use of their amazing connections and knowledge. Thank-you!","Leeds, United Kingdom",3/17/2013
Mondrian London at Sea Containers,5,excellent hotel,"fabulous Hotel......... great location and brilliant staff... | don't miss the cocktail bar and the champagne bar on the roof.. Wonderful abiance and layout, very stylish and chic hotel. Only slight criticism there was some very slight confusion on using the lift? But this is very minor and once we knew what we were doing not an issue. Brilliant hotel. | Well worth a visit or two!! |",Shropshire,7/28/2015
Apex London Wall Hotel,5,Not sure I want to share..............,What a triumph. This is one of the best hotel experiences I have had. The Apex London Wall is well situated in the heart of the financial district. The position is quiet and off the main drag. Five minutes walk to two different tube stations offering a great availability of lines. The welcome was warm and efficient and the room superb. Everything good quality and comfortable. We didn't eat at the hotel restaurant as it is so easy to wander into the city but we did try room service and it was spot on. | This hotel has the formula of price v location v services just right. I hope it stays this way as it makes a refreshing change.,"Shrewsbury, United Kingdom",5/3/2012
45 Park Lane - Dorchester Collection,5,Par 45,Par 45 <U+0641><U+064A> <U+0627><U+0644><U+0628><U+0627><U+0631><U+0643> <U+0644><U+064A><U+0646> | <U+062C><U+0644><U+0633><U+0629> <U+0628><U+0627><U+0631> <U+0641><U+0642><U+0637> <U+0644><U+0644><U+0634><U+0631><U+0628> | <U+0645><U+0634><U+0631><U+0648><U+0628><U+0627><U+062A> <U+0643><U+062D><U+0648><U+0644><U+064A><U+0647> | <U+064A><U+0648><U+062C><U+062F> <U+0644><U+062F><U+064A><U+0647><U+0645> <U+0633><U+0646><U+0627><U+0643> <U+062E><U+0641><U+064A><U+0641> <U+0628><U+0633> <U+0627><U+0644><U+062C><U+0644><U+0633><U+0647> <U+0631><U+0627><U+064A><U+0642><U+0647> | <U+0627><U+0644><U+0645><U+0643><U+0627><U+0646> <U+0631><U+0627><U+0641><U+064A> <U+062C><U+062F><U+0627><U+0627><U+0627><U+0627><U+0627><U+0627><U+0627> <U+0627><U+0644><U+0634><U+0627><U+0645><U+0628><U+064A><U+0646> <U+062C><U+0645><U+064A><U+0644> <U+062C><U+062F><U+0627>. | <U+0648><U+0627><U+0643><U+0648><U+0643><U+062A><U+064A><U+0644><U+0627><U+062A> <U+062C><U+062F><U+0627><U+0627><U+0627><U+0627> <U+0644><U+0630><U+064A><U+0630><U+0647> .............. | <U+064A><U+0648><U+062C><U+062F><U+0644><U+062D><U+0645> <U+0644><U+0637><U+0644><U+0628><U+0627><U+062A> <U+0627><U+0644><U+062E><U+0641><U+064A><U+0641><U+0647> | <U+2764><U+FE0F><U+2764><U+FE0F>,NA,9/19/2017
The Savoy,2,Not good enough!,"It was a special day out for my elderly Mothers Birthday which started off nicely . The staff were delightful BUT the tea experience was not. It started off ok with lovely sandwiches then went downhill very fast. After we had eaten the sandwiches and scone we were ignored for about 30 minutes - we looked around the room and nobody had been offered a pastry and our waiter was nowhere to be seen. Eventually a tray of pastries arrived and we felt we should only choose 1 or maybe 2 in the hope the tray would return shortly to offer you some more but sadly that didn't happen. After another 20-30 mins we were asked if we were ready for a piece of cake. Unfortunately it was just too late and the moment had past as after an hour and 45 we had waited around for too long. I asked for the cake to be boxed to take home only to be told they have changed the policy and you can't take anything with you. I have to say I was shocked - as we regularly visit hotels in London who kindly box some pastries for you to take home which is part of the tea experience. So for £50 plus service we had sandwiches , a scone and a pastry which frankly is appalling ! I was so upset that I called the manager who apologised but it was too late and my Mothers Birthday treat was ruined !",Bucks,7/7/2015
