video_id,title,publishedAt,channelId,channelTitle,categoryId,trending_date,tags,view_count,likes,dislikes,comment_count,thumbnail_link,comments_disabled,ratings_disabled,description
"evbYak4_h9w","MA COLLECTION DE DR MARTENS","2019-09-09T17:34:54.000Z","UCxDsG8fSVjsYjTE_ga6YJ7Q","Esile","24","19.13.09","esile|dr martens|doc martens|doc|ma collection de|ma collection|ma collection de dr martens|dr martens collection|shoes|je vous présente|esile nike|esile custom|esile bff 4ever|esile bf 4ever|bf 4ever|esile anecdote|esile swap|esile nimport koi","239904","22575","198","713","https://i.ytimg.com/vi/evbYak4_h9w/default.jpg","False","False","*clap* bonjour à tous! Je vous retrouve aujourd'hui dans une vidéo où je vais vous présenter ma collection de Dr Martens (enfin 6 paires mdr) J'ai mis pas mal de temps à réaliser cette vidéo alors j'espère vraiment qu'elle vous plaira, en tout cas c'était bien sympa à réaliser!Merci Gab, Luc et mon frère de m'avoir aidé à filmer!Les tenues :-Tenue 1 :son : https://www.youtube.com/watch?v=BT4c5qlqTGUhaut : pull acne studiobas : pantalon urban outfitterschaussures : dr martens basses noires-Tenue 2 :son : https://www.youtube.com/watch?v=Zig0Sh9VIx8haut : pull 2nde main (était à la maman d'une amie)bas : pantalon 3 suisses sur vintedchaussures : dr martens basses marrons-Tenue 3 :son : https://www.youtube.com/watch?v=aaIHe9Y8eP4haut : tshirt brandy melville + chemise lévisbas : short zafulchaussures : dr martens basses bleues pastelchaussettes : elles étaient à ma maman-Tenue 4 :son : https://www.youtube.com/watch?v=r6-8FEYuEYghaut : pull and bearbas : pantalon zafulchaussures : dr martens basses noires caroline-Tenue 5 : son : https://soundcloud.com/tomomp3/indecisonhaut : pull 2nde main (était à la maman d'une amie)bas : jean Lévischaussures : dr martens basses roses-Tenue 6son : https://www.youtube.com/watch?v=qusXIbGZiSshaut : tshirt pull and bear + chemise monkibas : short mangochaussures : dr martens hautes noiresréseaux sociaux :insta : @elisehebtwitter : @eliseheb1la bise"
"Lt4WIFHQqjo","L'interview complète de Booba","2019-09-08T09:00:05.000Z","UCSKdvgqdnj72_SLggp7BDTg","Brut","10","19.13.09","brut|booba|interview|b2o|92i|boulogne|album|lyrics|paroles|feat|kaaris|damso|angèle|clip|officiel|la fouine|orly|avion|bagarre|combat|octogone|suisse|titre|arc en ciel|dkr|veyron|bugatti|musique|music|2019|miami|fouiny","607008","20509","1277","2048","https://i.ytimg.com/vi/Lt4WIFHQqjo/default.jpg","False","False","La fusillade pendant le tournage de son clip, l’octogone avec Kaaris, ce qu’il pense d’Emmanuel Macron, sa vie familiale… Pour Brut, Booba répond aux questions de Karim Rissouli.Détracteurs, ennemis, Elie, B2O ou Booba affirme en tout cas ne pas être prêt à quitter son trône. Peu de temps après la fusillade lors du tournage de son clip à Aulnay-Sous-Bois, le rappeur est conscient que ses ennemis sont nombreux. Kaaris, Fred de Sky ou encore Damso…S’il ne peut dire qui est à l’origine de la fusillade, il précise néanmoins que « tout se sait ».Des ennemis nombreux certes, mais le premier d’entre eux pour Booba, c’est Kaaris. Malgré les rumeurs entourant l’octogne, le combat d’art martial prévu entre Kaaris et lui, ce dernier insiste sur la tenue de l’évènement. Il se tiendra le 30 novembre prochain, en Suisse.Au sujet de la politique française et de la crise des gilets jaunes, Booba est catégorique : « Le peuple je le comprends toujours. Je suis le peuple ». Pour lui, la politique du Président Emmanuel Macron n’est pas à la hauteur de la crise. Il dit comprendre les revendications des gilets jaunes, lui pour qui « l’argent, c’est la liberté ».Si Booba admet peu parler de politique dans ses chansons, un sujet retient son attention : l’histoire de la colonisation, l’absence de devoir de mémoire de la colonisation. Pour lui une question demeure, « comment peut-on faire ça ? ». Il confie à Karim Rissouli que bien qu’il le fasse, ce n’est pas à lui d’effectuer ce travail de mémoire.Booba écolo ? En tout cas le rappeur se dit de plus en plus préoccupé par le changement climatique, sans doute, selon lui, depuis qu’il est père. Pas question néanmoins de changer son mode de vie, il considère que c’est aux dirigeants de prendre les mesures nécessaires.Sur sa fin de carrière, Booba pense bientôt se reconvertir dans d’autres domaines, plus proches de la gestion de sa maison de disques. Encore un, deux albums ? Une chose est sûre, il n’y en aura pas trois autres selon le rappeur.—————————————  ▶︎ Retrouvez la vidéo sur le site de Brut▶ 📲 sur l’appli Brut (iOS) : https://apple.co/2UY7gNH ▶ Pour ne rien louper des vidéos Brut, n’hésitez pas à vous abonner ➞ https://www.youtube.com/channel/UCSKdvgqdnj72_SLggp7BDTg/?sub_confirmation=1 et à activer la cloche 🔔"
"AAfs757FdJ0","JE VAIS VOIR LA PRISON D’ALCATRAZ","2019-09-08T13:00:27.000Z","UC_446tDNo7UckPX78hM0Nlg","Neoxi","23","19.13.09","neoxi|humour|fun|alcatraz|prison|prison alcatraz|mythes et legendes neoxi|sur les traces de|sur les traces de la prison d'alcatraz","1273313","141532","710","3915","https://i.ytimg.com/vi/AAfs757FdJ0/default.jpg","False","False","Cette fois on part sur les traces de la prison d’Alcatraz, une des prisons les plus légendaires au mondeC’était un plaisir intense de réaliser cette vidéo, un vrai « rêve » de pouvoir visiter ce lieu si emblématique ════════════════════════════════════════­► Chaîne secondaire : https://www.youtube.com/c/Nezauski► Twitter : https://twitter.com/Neoxi_► Instagram : https://www.instagram.com/valentinyt► Jeux MOINS CHERS : http://www.instant-gaming.com/igr/NeOxi/════════════════════════════════════════­Cadrage : Raphaël.HMontage : Raphaël.H"
"PpC_oRnyqtY","LA VOITURE - JAYMAXVI","2019-09-08T16:00:04.000Z","UCqbuA8ddKCjBJndL5Ei_mBg","Jaymax VI","23","19.13.09","VOITURE|MERCEDEZ|GOVA|TCHOP|JAYMAXVI|PERMIS|CONDUIRE|CONDUITE|VEHICULE|ROUE|POLICE|POLICIER|JAYMAX|IZZEL|TONTON|PEMBE CHEROLE|PEMBE|VINE|VINES|LA VOITURE|VOITURIER|GOV|RETROGRADER|AUTOMATIQUE","422946","26471","570","947","https://i.ytimg.com/vi/PpC_oRnyqtY/default.jpg","False","False","En voiture..ABONNE TOI A MA CHAINE YOUTUBE ET A MES RESEAUX SOCIAUX SNAPCHAT 👻 : Jay_maxvi INSTAGRAM : http://www.instagram.com/jaymaxvi FACEBOOK : http://www.facebook.com/jaymaxvi TWITTER : http://www.twitter.com/jaymaxvi"
"7AWQYB5DQSM","France-Albanie (4-1), le résumé I Équipe de France 2019","2019-09-09T06:30:01.000Z","UCeJlXGyEl7kBgQJKADAHM3A","Fédération Française de Football","17","19.13.09","FFF|FFF TV|Equipe de France|les bleus|french|french team|soccer|football|France-Albanie|Euro 2020|résumé|buts|highlights|Giroud|doublé Coman|Ikoné|but","270173","3397","104","343","https://i.ytimg.com/vi/7AWQYB5DQSM/default.jpg","False","False","Sur la pelouse du Stade de France, l'équipe de France a réussi le samedi 7 septembre sa rentrée en battant l'Albanie (4-1) dans le cadre des éliminatoires de l'Euro 2020. Un succès, acquis grâce à un doublé de Kingsley Coman et des buts d'Olivier Giroud et Jonathan Ikoné, qui lui permet de virer en tête du groupe H à mi-parcours.Tous les buts, les résumés, les inside, de toutes les sélections, la Coupe de France, le foot féminin, le futsal, le beach soccer, le foot amateur, la formation, les championnats de National, D1 Féminine, D1 Futsal... ne ratez rien et abonnez-vous à notre chaine FFF: https://goo.gl/1Pc8MwPlus d'infos sur: www.fff.fr--------------------------------------------------------------------------------------------Les Bleus en Russie : https://lesbleusenrussie.fff.fr/?utm_source=prehomefffFFF : https://www.fff.frFacebook : https://www.facebook.com/fffTwitter :  https://www.twitter.com/FFFYoutube :  http://www.youtube.com/c/FFFDailymotion :  http://www.dailymotion.com/ffftv EQUIPES DE FRANCE : https://www.fff.fr/equipes-de-france Facebook :  https://www.facebook.com/equipedefranceSnapchat :  http://po.st/SnapchatEdFTwitter :  https://www.twitter.com/equipedefrance  Instagram :  https://www.instagram.com/equipedefrance Vine :  https://vine.co/EquipeDeFranceGiphy :  https://giphy.com/equipedefrance COUPE DE France : https://www.fff.fr/coupes Facebook :  https://www.facebook.com/coupedefranc... Twitter :  https://www.twitter.com/coupedefrance CHAMPIONNAT NATIONAL : http://po.st/yTSGBt Facebook : https://www.facebook.com/nationalFFF  CNF CLAIREFONTAINE :  http://www.cnf-clairefontaine.com Facebook :  https://www.facebook.com/fffTwitter :  https://www.twitter.com/FFF--------------------------------------------------------------------------------------------La Fédération Française de Football (F.F.F.) est une association loi de 1901 qui a pour mission:- d'organiser la pratique du football, sous toutes ses formes;- d’établir les règles techniques;- de délivrer les titres et gérer les sélections nationales;- de procéder à la délivrance des licences;- de définir et de mettre en œuvre un projet global de formation;- de défendre les intérêts du football français."
"FF4J9LJVrl4","MONTER UNE TROTTINETTE LES YEUX BANDÉS (feat. AlanFoodChallenge)","2019-09-09T15:30:19.000Z","UCPGUfCravJ90MlO9SC_fnAA","scoot 2 street","24","19.13.09","scoot2street|scoot 2 street|scoot de street|s2s|alan foodchallenge|alan92 foodchallenge|defi|challenge|monter une trottinette les yeux bandes|yeux bandes|trottinette freestyle|trotinette","136566","6632","194","280","https://i.ytimg.com/vi/FF4J9LJVrl4/default.jpg","False","False","scoot 2 street vs Alan92 FoodChallenge, on s'affronte les yeux bandés Abonne-toi, clique ici ➥ http://bit.ly/2vV7b2P ✅►Pour voir la 2ème vidéo : https://youtu.be/1pwAdDftbQIMon site Internet : https://www.scoot2street.com/**Nouveauté S2S** stickers, bracelets, tee-shirts, grips, sweats...--------------- ★ VIENS RIGOLER AVEC MOI ★ ---------------*des lives, concours, storys de dingue et du fun ► INSTAGRAM: scoot2street ► TWITTER: https://twitter.com/scoot2street ► FACEBOOK: https://facebook.com/scoot2street  ► SNAPCHAT: scoot2street-------------------- ★ INFOS ★ --------------------La chaîne de Alan : http://bit.ly/2xBbxgCMoi antoine s2s (scoot 2 street) avec le pote Alan FoodChallenge de la chaîne YouTube : Alan92 FoodChallenge ons'affronte les yeux bandés sur 5 défis (challenge). On a comme defi monter une trottinette freestyle les yeux bandes, faire un fat burger les yeux bandés aussi et d'autres défis challenges.Active la 🔔 pour ne rater aucune vidéo !Merci d'avoir regardé et d'avoir gardé le sourire ! 😃"
"mW4BsgXdt2M","❥ DEUXIÈME CHANCE & PREMIERES IMPRESSIONS","2019-09-09T15:00:07.000Z","UCRRD9uu-PuwTUQQ4eJyQeXg","💜Sandrea","26","19.13.09","Sandrea|sandrea26france|youtubeuse|beauté|maquillage|makeup|deuxieme chance et premiere impressions|font beauty|too faced|Anastasia Beverly Hills|morphe","120860","6702","116","258","https://i.ytimg.com/vi/mW4BsgXdt2M/default.jpg","False","False","🛑 DEROULE CETTE BARRE POUR PLUS D'INFO ⬇️🙏🏻 N'oubliez surtout pas d'activer la cloche 🔔 pour ne rater aucune de mes publications! Et n'hésitez pas à laisser un petit 👍🏼 si la vidéo vous a plu! MAIS SURTOUT  💜MERCI du fond du coeur pour votre abonnement❥ SUR MOIMa robe: House of CB Mon Vernis: Bubble Bath | OPIMes boucle d'oreilles: ASOS ➣ PRODUIT MENTIONNÉS:- Primer | Back Stage | Dior http://bit.ly/316yQMb- Fond de teint | Fenty Beauty http://bit.ly/318lnn4- Anti cernes | Instant Anti Age | Maybelline  http://bit.ly/2HUzAws- Poudre | ABH http://bit.ly/2HVa5v7- Bronzer/Highlighter | Morphe https://bit.ly/2lFFuJH- Blush | Morphe https://bit.ly/2lBw7up- Base fard à paupière | ABH  http://bit.ly/315l9NL- Palm Springs Palette | Too Faced http://bit.ly/2HXnXES (Coming Soon)- Crayon Sourcils | Fenty Beauty http://bit.ly/2HXnXES- Rouge à lèvres | Nude |  L'Oréal X Caroline Receveur http://bit.ly/2HVFPQG❥ROOM TOUR:Envie de voir ce qui se passe autour de moi? Cliques ici pour voir le Tour de cette piece: https://youtu.be/u3-WrXLSi8w♡ OU ME TROUVER: ♡ ♡ Instagram:www.instagram.com/Sandrea26France♡Twitter:https://twitter.com/Sandrea26France♡Snap Chat:Sandrea26Snap♡ Page Fan Facebook:https://www.facebook.com/Sandrea26France♡Mon Blog Décohttps://twoleblog.comJE VOUS AIME!!!♥♥♥Disclaimer: Cette vidéo n'est pas une vidéo sponsorisée ou en partenariat avec une entreprise.Certains liens peuvent être des liens d'affiliation.Certains produits présentés peuvent être des produits reçus gratuitement. Cela ne change en rien les avis que j'émets sur ma chaîne. :)Liens affiliés *Produit reçu gratuitement **"
"RPzX9LgIris","Les Z'amours - 60 minutes avec Kheiron","2019-09-09T06:00:09.000Z","UCauAWhL009yPNGHjIuGkmqQ","Kheiron","23","19.13.09","Kheiron|humour|one man show|stand-up|spectacle|Bref|Nous trois ou rien|Paris|impro|impros|improvisation|improvisations","238066","7381","121","146","https://i.ytimg.com/vi/RPzX9LgIris/default.jpg","False","False","➡ 4 dates à PARIS en 2019 (et pas une de plus !)➡ En Tournée dans toute la France http://www.kheiron.fr Toi aussi, viens vivre des soirées uniques à mon spectacle, différent chaque soirFilmé à LA CHAPELLE SAINT LUC"
"SGr7l-xz0q4","Le youtubeur et rappeur PRIME fait salle comble à l'Olympia","2019-09-08T18:44:46.000Z","UCfHn_8-ehdem86fEvlFg-Gw","Le Parisien","25","19.13.09","prime|rappeur prime|Youtubeur Prime|olympia|la courneuve|Paris|Musique|prime olympia","501049","19307","372","687","https://i.ytimg.com/vi/SGr7l-xz0q4/default.jpg","False","False","Sans maison de disques et sans album, le rappeur PRIME a rempli son premier Olympia. Un exploit pour ce Youtubeur venu de la cité des 4 000, à la Courneuve, et qui a percé grâce à Internet.Merci à https://www.youtube.com/user/PrimeTimeFUT pour son accueil Retrouvez toute l’info sur Le Parisien : http://www.leparisien.fr/ Abonnez-vous à notre page Facebook : https://www.facebook.com/leparisien/Suivez-nous sur Instagram : https://www.instagram.com/leparisien/Rejoignez-nous sur Twitter : https://twitter.com/le_ParisienVous avez une vidéo à nous proposer ? vous souhaitez nous contacter ?Ecrivez-nous à cette adresse : video@leparisien.fr#primeolympia #PrimeGanG"
"ln3yVkGPwDQ","DEGUSTATION : RATION MYSTERE DE POLOGNE !","2019-09-09T15:45:01.000Z","UCnClLaSOAGa8VY8vH7zhT7A","PI-WAN","22","19.13.09","degustation|ration|mystere|pologne|polonais|repas|ration de combat|maison|pi-wan|pi wan|piwan|dégustation ration|degustation polonais","95029","4602","84","334","https://i.ytimg.com/vi/ln3yVkGPwDQ/default.jpg","False","False","Dégustation d'une ration de combat mystère de Pologne. Une ration de combat maison composée de plats et repas succulents Polonais !Clique ici pour t'abonner ► http://www.youtube.com/c/Pi-Wan?sub_confirmation=1Pour me Soutenir sur Youtube ► https://gaming.youtube.com/c/Pi-WanInstagram ►Piwanx Discord ► https://discordapp.com/invite/pi-wanTwitter ► http://twitter.com/PiWanXFacebook ► http://www.facebook.com/Pi.wan.officielTwitch ► https://www.twitch.tv/piwanxSnapchat ►Pi-WanSite web ► http://www.Pi-Wan.comBoîte postale ► Pi-Wan Centre MBE 193 - 2 Bis avenue Durante 06000 NiceMontage ► Boun https://www.youtube.com/channel/UCSp8B7cBc_RxhrHeIvmwh8gLes partenaires de la chaîne en matériel de survie et rations :https://www.terrang.fr/ -10% avec le Code : PIWAN10 https://www.lyophilise.fr/ -10% avec le Code : LYOPIWANhttp://www.materiel-survie.fr/ -10% avec le Code : PIWANKITSi tu souhaites me soutenir et que tu aimes mes vidéos de dégustation de ration, lâche un pouce bleu et abonne-toi . 👍Si tu es déjà abonné, pense à activer les notifications en cliquant sur la cloche grise après t'être rendu sur la page d'accueil de ma chaîne 🔔Cette vidéo à été mise en ligne sur Youtube depuis la France en Septembre 2019. Pi-Wan présente une ration de combat polonaise préhistorique à travers une dégustation et le commente en français. Cette vidéo se classe dans la catégorie People et Blogs.Pour contribuer aux sous-titres de mes vidéos et avoir mon éternelle reconnaissance : https://www.youtube.com/timedtext_cs_panel?tab=2&c=UCnClLaSOAGa8VY8vH7zhT7A#Ration #Dégustation #Pologne"
"S63gJTsLiXc","Daniil Medvedev vs Rafael Nadal | US Open 2019 Finals Highlights","2019-09-09T02:10:22.000Z","UCXbboag48Qlr78zzz6SkzkQ","US Open Tennis Championships","17","19.13.09","US Open|tennis|rafael nadal|daniil medvedev|nadal|medvedev|sports|finals|highlights|us open 2019|us open highlights 2019|us open men's final 2019|rafael nadal us open 2019|rafael nadal vs daniil medvedev|daniil medvedev us open|nadal wins|nadal beats medvedev|medvedev us open 2019|rafael nadal victory|medvedev vs nadal","2670203","24903","1101","3243","https://i.ytimg.com/vi/S63gJTsLiXc/default.jpg","False","False","Rafael Nadal defeats Daniil Medvedev in the Finals of the US Open 2019."
"vOB-56n4XCc","Internet est mort. (et vous aussi)","2019-09-08T18:00:05.000Z","UCNiauGTV7XhkOpUAIXod4xA","Léo Duff","28","19.13.09","nsa|snowden|national security agency|edward snowden|united states national security agency|privacy|surveillance|barack obama|hacking|hacker|fbi|guardian|big brother|léo duff|security","246508","28044","569","1413","https://i.ytimg.com/vi/vOB-56n4XCc/default.jpg","False","False","Et si je vous disais qu’en réalité, on est tous morts ?-75% de réduction (2,62€/mois) sur NordVPN avec le code « leoduff »http://bit.ly/OffresNordVPN→Soutenir la chaîne : https://www.youtube.com/channel/UCNiauGTV7XhkOpUAIXod4xA/joinSources notables : Citizenfour : http://www.allocine.fr/film/fichefilm_gen_cfilm=231662.htmlNothing to hide : http://www.allocine.fr/film/fichefilm_gen_cfilm=253027.htmlNulle part où se cacher : https://amzn.to/319M0IBMiniature : https://instagram.com/quentinbrreMusiques :Bring to light - Max HWonder - Tristan BartonLet's do it to ourselves - Tomas HerudekLioness - Kevin GrahamBreath in - Yehezkel RazOutline - Michael VignolaLéo Duff."
"PD8aI9k3Ohw","Je retourne à l'école primaire pendant une journée | DENYZEE","2019-09-08T11:00:04.000Z","UClOeGHFiUlegRJFGhkMxoHg","DENYZEE","23","19.13.09","denyzee|denize|denize quebec|denyze|denizee|drôle|humour|vidéo humour|vidéo drôle|québécoise|youtubeuse humour|24h|24h challenge|défi|défi 24h|back to school|back to school 2019|je retourne à l'école|école|denyzee école|retourner à l'école|vivre une journée à l'école|une journée à l'école|école primaire|rentrée 2019|rentrée des classes|rentrée scolaire|denyzee rentrée|rentrée scolaire 2019|rentrée|je rentre à l'école|back to school 2019 fr|école québec","880324","57627","974","3084","https://i.ytimg.com/vi/PD8aI9k3Ohw/default.jpg","False","False","C'est semaine c'était la rentrée scolaire 2019! Pour moi aussi! À l'occasion du Back to school, j'ai relevé le défi de retourner à l'école primaire, 20 ans plus tard 😂➡️  Rejoins la famille en t'abonnant à ma chaîne: http://bit.ly/2gcKjr9 Ouesh.✌️➡️  Tu veux plus de vidéos drôles? Rejoins-moi sur Instagram: http://bit.ly/2LYxPy8Pendant toute une journée, je suis retournée à l'école. Ce défi 24h challenge était tout simplement génial et très épuisant. En tant qu'adulte, quand on retourne à l'école avec des enfants, on s'aperçoit à quel point le rythme est difficile à tenir. Les jeunes sont tellement énergiques et pleins de vie, qu'il peut être assez difficile pour un adulte de devoir se rasseoir sur les bancs d'école et étudier.Merci beaucoup à l'équipe école de Saint-Eusèbe de m'avoir gentillement accueillis pendant leur journée de rentrée.Merci aux parents et aux enfants présents cette journée là, de m'avoir accueillis les bras ouverts!Si tu lis ceci, écris moi dans les commentaires quelle expérience sociale tu veux que je vive? Vidéo de DENYZEECette chaîne est une chaîne youtube de divertissement et d'humour. Ce programme tous publics aussi appelé contenu familial vidéo est adapté aux annonceurs de type divertissement & humour favorable à la famille en français.-------➡️  Si tu as lu jusqu'ici, écris ÉCOLE en commentaires.-------➡️  Si tu veux m'aider à traduire les vidéos, c'est par ici: http://www.youtube.com/timedtext_cs_panel?tab=2&c=UClOeGHFiUlegRJFGhkMxoHg-------DENYZEE, c'est une chaîne Youtube humour, des sketchs comiques de divertissement qui propose des défis/challenge et expériences sociales.J’imite bien l’accent québécois aussi.-------Rejoins-moi sur:Facebook: http://bit.ly/denyzeefacebookInstagram : https://www.instagram.com/denyzee_Twitter : https://twitter.com/denyzee_Snapchat : dlfn06Aide montage: Sébastien Martinez"
"IcxRP9gubOA","ENFIN UNE NIGHT & MORNING ROUTINE... REALISTE lol","2019-09-08T15:03:25.000Z","UCfw2vZe-LCYVbkeRIfWkMuw","Hellcat","24","19.13.09","morning|night|routine|soir|matin|hotel|vacances|pull&bear|levis|maquillage|tuto|tutoriel|benefit|too faced|sephora|piscine|highlighter|doré|nyx|piercing|nez|créoles|cheveux|bouclés|curly|hair|caremex","220615","17767","313","348","https://i.ytimg.com/vi/IcxRP9gubOA/default.jpg","False","False","Hey ♡J'étais en vacances et je voulais faire un petit vlog mais au final ça s'est transformé en night et morning routine haha :)➳ EbuyClub : https://goo.gl/sX5w2D➳ Pour trouver et acheter les vêtements que je porte : https://www.21buttons.com/anaizzle♡  ♡  ♡  ♡  ♡  ♡Abonne-toi pour ne manquer aucune vidéo : https://www.youtube.com/channel/UCfw2vZe-LCYVbkeRIfWkMuwMa dernière vidéo : https://www.youtube.com/edit?o=U&video_id=sGouCwA1yXIInstagram: https://www.instagram.com/anaizzle_/Twitter: https://twitter.com/onceuponhellcatSoundcloud : https://soundcloud.com/onceuponhellcatMon adresse mail pro :onceuponhellcat@gmail.com♡  ♡  ♡  ♡  ♡  ♡"
"h-ce3gPMsGc","2019 Italian Grand Prix: Race Highlights","2019-09-08T18:37:31.000Z","UCB_qr75-ydFVKSF9Dmo6izg","FORMULA 1","17","19.13.09","F1|Formula One|Formula 1|Sports|Sport|Action|GP|Grand Prix|Auto Racing|Motor Racing|Italian Grand Prix|Monza|Ferrari|Leclerc|Vettel|Hamilton|Bottas|Mercedes|F1 Race Highlights","3369013","61420","1262","7817","https://i.ytimg.com/vi/h-ce3gPMsGc/default.jpg","False","False","Watch the best bits from an unforgettable race at Monza.For more F1® videos, visit http://www.Formula1.comLike F1® on Facebook: https://www.facebook.com/Formula1/Follow F1® on Twitter: http://www.twitter.com/F1Follow F1® on Instagram: http://www.instagram.com/F1#F1 #ItalianGP"
"J-98zZMt-Yg","Rilès - QUEEN (Lyric Video)","2019-09-08T16:47:38.000Z","UC-NwsBEyZqZnPc9OaCFJSsw","Rilès","10","19.13.09","RIlès|riles|queen|welcome to the jungle|thank god|rilesundayz|ryles|drake|post malone|feel like i'm done|hey wallah something watching real close to me|hey wallah blessings|brothers|against the clock|myself n the sea|marijuana|uptempo","181295","11747","68","437","https://i.ytimg.com/vi/J-98zZMt-Yg/default.jpg","False","False","'QUEEN', TRACK #5 OFF MY DEBUT ALBUM:WELCOME TO THE JUNGLE - https://riles.lnk.to/WelcomeToTheJungleinstagram: http://instagram.com/0rilestwitter: http://twitter.com/0rilesfacebook: http://facebook.com/0rilesTOUR: https://www.rilesundayz.com/tour_____________Lyrics:Feel like I'm doneCalling madameRolling a bluntShe lift me upCuz she my queenYea she the oneI reminisceShe kills the spleenThen I go onI make a songGold in a weekHow life is funHey wallah something's watching real close to meHey wallah blessings come when I'm diving in213 calling, yema, fam, feeling greatIf I don't quit here, this means I'll never quitNow we really rockin' fashion showsMy friends designing clothesMy yema quit the workAnd baba's counting all the 0sRilesundayz finally growsBeen 2 years in a rowYèa patience was the keyAnd now we kicking with the prosYea I'm coming I'm, comingDive or run and I'm runningNever gone if I'm leaving-Keep on going if I go awayBitches n yamz'lone with the gangTennessee drinksWhen you too farI'm getting clo-Ser to my sinsLotta despairMany mistakesIn my defenceSkippin' that loveAs if it was hitting my legsHey wallah something's watching real close to meHey wallah blessings come when I'm diving in213 calling, yema, fam, feeling greatIf I don't quit here, this means I'll never quitMy AdderallMy sins you soakWe feel like kidsAnd I- I feel like yoursMy bitch is smartMy bitch is dopeMy bitch dangerousShe real bad andBabyIf I dive let me inIn case I'm drowningMaybe I'll meet you as an angelFeel like I'm doneCalling madameRolling a bluntShe lift me upCuz she my queenYea she the oneI reminisceShe kills the spleenThen I go onI make a songGold in a weekHow life is funHey wallah something's watching real close to meHey wallah blessings come when I'm diving in213 calling, yema, fam, feeling greatIf I don't quit here, this means I'll never quit"
"Hioxh9PUJgo","LE RACISME ANTI-BLANC","2019-09-08T16:15:01.000Z","UCbJ1LG_FylZmLtwjyTErC_w","Sami Ouladitto","23","19.13.09","sami ouladitto|micro bankal|microbankal|micro trottoir|interview|sondage|dans la rue|episode|humour|piéger|prank|sami|racisme|racisme anti blanc|micro trottoir racisme|anti-blancs|2019|racisme anti blanc existe","149294","12297","843","796","https://i.ytimg.com/vi/Hioxh9PUJgo/default.jpg","False","False","#MICROBANKAL White Panther !Suivez-moi sur mes réseaux sociaux la miff ! :Facebook : http://facebook.com/samiouladittoInstagram : @samiouladittoTwitter : @samiouladitto"
