video_id,title,publishedAt,channelId,channelTitle,categoryId,trending_date,tags,view_count,likes,dislikes,comment_count,thumbnail_link,comments_disabled,ratings_disabled,description
"0T8Oym6VtNs","TOP 10 des MEILLEURS MOMENTS d'AVENGERS: ENDGAME !","2019-09-08T10:00:01.000Z","UCRk_DB5ZQQcREqsWTeqqzLg","WatchMojo Français","24","19.13.09","meilleurs moments d'avengers|meilleurs moments endgame|meilleurs moments avengers endgame|best of avengers|claquement de doigts|claquements de doigts tony stark|je suis iron man|robert downey jr|marvel studios|easter egg|MCU|Marvel|Avengers|Avengers : Endgame|meilleurs moments|œil-de-faucon|veuve noire|captain america|tony stark|thor|film|cinéma|top 10|watchmojo|watch mojo|watchmojo français|watchmojo francais|france|fr","126122","5160","124","452","https://i.ytimg.com/vi/0T8Oym6VtNs/default.jpg","False","False","Mettez un pouce bleu si la vidéo vous a plu !Une idée de vidéo ? Proposez-la ici : http://watchmojo.com/suggestionC'est sans doute le film de l'année, en tout cas le plus populaire, qui a pulvérisé de nombreux records en salle et dans les critiques ! Avengers: Endgame est la finalité de plus de 10 ans de films des studios Marvel, 3 heures épiques et amusantes, qui parfois nous font aussi pleurer. On vous propose de revivre les meilleurs instants du film !Joignez-vous à WatchMojo Français pour le Top 10 des meilleurs moments du film Avengers: Endgame !Suivez WatchMojo Français sur les réseaux sociaux :Facebook : https://www.facebook.com/watchmojofrancais/Instagram : https://www.instagram.com/watchmojofr/Twitter : https://twitter.com/wmfrancaisAbonnez-vous : https://www.youtube.com/user/watchmojofr et activez la petite cloche pour recevoir les notifications ! #Avengers #AvengersEndgame #MarvelWatchMojo Français publie chaque semaine 8 vidéos sur vos thèmes préférés de la pop-culture : jeux vidéo, animés, comics, cinéma, télévision, internet, sport, musique et plus encore !"
"RmNpmkg7jSI","Un poisson SUPER BIZARRE capturé sur LA PLAGE ! - Cyril Chauquet","2019-09-08T14:00:08.000Z","UCLYiaHiSeTC-qwjuzrKaxCg","Cyril Chauquet","19","19.13.09","pêche|mordu de la pêche|Voyage|Fishing (TV Genre)|cyril chauquet|fishing adventurer|poisson|aventure|adventure|Travel|Nature|pêche xxl|chasing monsters|saison|peche|raie|guitare|gabon|plage|surf|casting|bizarre|weird","199596","3467","79","112","https://i.ytimg.com/vi/RmNpmkg7jSI/default.jpg","False","False","Cyril est au Gabon, à la recherche d'une grosse cubera depuis la plage ! Mais alors qu'il pense avoir capturé un requin, c'est un tout autre poisson qui vient s'échouer sur le bord... Pour ne rien louper de nos prochaines vidéos suivez-nous sur nos réseaux : ► Site web: http://www.cyrilchauquet.com/► Instagram: http://www.instagram.com/mordudelapeche► Facebook: https://www.facebook.com/Mordudelapechetv"
"gvIizUP3ahw","MA NOUVELLE MOTO 🔥 (oui encore)","2019-09-08T08:00:08.000Z","UC4A5Uc2lnOiXKHWu3vCax9A","Carbone23","2","19.13.09","nouvelle moto|moto|motard|fr|france|yamaha|mt07|mt-07|mt 07|fz07|fz-07|fz 07|xsr700|xsr 700|yzf R3|R3|motorcycle|motorbike|akrapovic|arrow|sc project|exhaust|loud|compilation|test|avis|do|do moto|daily observation|observation quotidienne|french|biker|south|carbone23|carbone 23|carbone|carbon23|carbon 23|carbon|carbonne23|carbonne 23|carbonne|23","134881","9892","315","619","https://i.ytimg.com/vi/gvIizUP3ahw/default.jpg","False","False","➡️ MES PARTENAIRES :► -10% chez Speedway à Aix-en-Provence en venant de ma part► Tunetoo : ma boutique : https://carbone23.tunetoo.com/► Yamaha Spirit Motor Aix-en-Provence➡️ MES RÉSEAUX SOCIAUX :► Mon Instagram :Carbone23Youtube► Mon Snapchat :Carbone23snap► Mon Facebook : https://www.facebook.com/carbone23youtube/► Mon Email : carboneyt23@gmail.com➡️ QUELQUES LIENS IMPORTANTS :► Boutique de vêtements / accessoires :https://carbone23.tunetoo.com/► Porte-clefs Carbone23 :https://motoloot.com/collections/partners-key-tags-1/products/carbone23-i-love-twerk-keychainPour tout problème de copyright ou droit d'image, envoyez moi d'abord un mail à l'adresse marquée ci-dessus, merci !❤️ Abonne toi pour encore + de fun !👍 Si tu as aimé👎 Si tu as pas aimé MAIS dit moi pourquoi📝 Commente pour donner ton avis 🗣 Partage si tu as aimé➡️ TOUTES LES MUSIQUES UTILISÉES DANS L'ORDRE DE PASSAGE :► Say That - Epidemic SoundCommente #NouvelleMoto si tu as lu jusqu’ici 😁Ride SafePeace ✌️"
"mJwoe3fVa2g","JE TESTE DES GADGETS WISH PENDANT 24H - HUBY","2019-09-07T11:59:20.000Z","UChTo-9JLadrq6doh6_550OA","HUBY","24","19.13.09","je teste des gadget wish|pendant 24h|huby|24h huby|isaac hub|hubi 24 heures|huby 24|24h challenge|hub24|24heures|wish|wish gadgets|wish haul|gadget|gadget 2019|wish test|je teste|je teste wish|hubi|hub 24|hubi 24|drole|video drole|mdr|challenge 24h|vetement wish|sèche cheveux|brosse à dents électrique|24 heures|huby 24h|24h|24h avec moi|carl is cooking|pendant 24 heures|une journée avec moi|defi|24hrs|wish gratuit|défi","566487","23832","823","1963","https://i.ytimg.com/vi/mJwoe3fVa2g/default.jpg","False","False","Aujourd'hui sur Huby... je fais un 24H challenge où je teste des gadgets WISH pendant 24hrs. Je teste des objets wish pendant 24h, c'est mon défi.#Huby #24h #challenge #wishAvec ce 24h challenge, je teste plein de gadgets wish 2019 pour voir s'ils fonctionnent vraiment. J'ai acheté plein d'objet wish et je les teste pour vous. C'est très drôle, vous passez une journée avec moi pendant que je teste des gadgets wish dans le quotidien.Vous allez passer 24h avec moi et je vais vous documenter mon état d'esprit pendant que je teste tous ces objet wish 2019. Vous allez passer une journée avec moi. C'est un challenge et un defi à mdr.Je fais un haul wish avec tous les gadgets wish 2019, je vais les tester et certain sont vraiment des jeux géniaux.Je teste un speaker pour la douche, un gadget pour le sèche cheveux, une brosse à dents électrique, des gadgets pour la toilette et Carl is cooking à même trouvé un vetement wish! Et il y a un item wish gratuit.Dis-moi en commentaire ton objet préféré et ce que tu veux me voir faire pendant 24h.C'était le fun de faire cette vidéo challenge où je teste des gadgets wish pendant 24h. Lâche un #grospoucedelike et partage la vidéo avec les gens qui veulent savoir ce qui se passe quand je teste des objets wish pendant 24h. Retrouve mon livre de slime ici:Au Québec: https://bit.ly/2TYhCNIEn France: https://bit.ly/2BTSrEPChaîne de CARL IS COOKING : https://bit.ly/1nAJhmiChaîne de VLOG FRANÇAIS Carl et Isaac : https://bit.ly/1QTzCyFLes 24H sont des programmes tous publics et aussi un contenu familial pour les annonceurs de type divertissement & humour apprécié par les familles en français.Abonne-toi et balance un pouce bleu 👍🏻💙INSTAGRAM : http://bit.ly/2A4lCEX  @isaachubSNAP : isaachubTWITTER : https://twitter.com/isaac_hubContact (business uniquement) : huby.contact@gmail.com ... et n'oubliez pas, FAUT PAS RESTER SAGE ! 🖖🏻🧔🏻😜 #huby"
"mZEJWrfLuWk","MON ACCOUCHEMENT","2019-09-07T10:19:08.000Z","UCdmGHoYdhb__gr8e-GKxaBQ","Caroline Vlog","26","19.13.09","accouchement|vlog","509788","24975","338","578","https://i.ytimg.com/vi/mZEJWrfLuWk/default.jpg","False","False","Ma boutique en ligne: https://www.ivylista.com/25€ offerts sur votre première réservation Airbnb : https://bit.ly/2IQQqLgRetrouvez-moi également sur ma chaîne lifestyle : http://bit.ly/chainebeauteMon livre Guide Healthy Lifestyle: http://bit.ly/2mz9Xak●●●●●●Blog : http://beauteactive.com/Facebook Twitter Instagram : @beauteactiveSnapchat : beaute-activeContact professionnel :contact@beauteactive.com"
"ibPslj6BMcI","Oxmo Puccino Ft. Orelsan - Ma life (Clip Officiel)","2019-09-06T10:00:01.000Z","UCXMsmrUmeJBdtKEDREREv-w","Oxmo Puccino [Officiel]","10","19.13.09","Oxmo Puccino|Ma life (Clip Officiel)|Orelsan|AllPoints|Hip Hop|French Hip Hop|La nuit du reveil|Peuvent pas|Le droit de chanter","1667912","55351","1961","2189","https://i.ytimg.com/vi/ibPslj6BMcI/default.jpg","False","False","Nouvel album La nuit du réveil disponible : https://ffm.to/oxmopuccinolndrTournée 2019 : http://oxmo.net/Abonnez-vous à la chaîne YouTube d'Oxmo Puccino : http://bit.ly/2gYOPcI Rejoignez Oxmo Puccino sur WhatsApp : https://mtl.fm/OxmoPuccinoWhatsAppUn film de Original KidsProduction Executive : HK CorpMA LIFEAuteur : Oxmo Puccino / OrelsanCompositeur : PhazzEdts : WCMF - DLP - Maison Lafiya - 7th Magnitude - Strong NinjaRéalisé par Phazz & Eddie PurpleRéédition de l’album « Opéra Puccino » disponible (CD/Vinyle) : http://bit.ly/OperaPuccinoRéédition « L’amour est mort » : https://oxmopuccino.lnk.to/LAmourEstMortRéédition « Le Cactus de Sibérie » : https://oxmopuccino.lnk.to/LeCactusdeSiberieRéédition « Lipopette Bar » : https://oxmopuccino.lnk.to/LipopetteBar✧ Ne loupez aucun contenu d'Oxmo !https://www.facebook.com/OxmoPuccinoOfficielhttps://www.instagram.com/oxmopuccinohttps://twitter.com/oxmopuccinohttp://oxmo.net/"
"5WOGob6rBn4","On se fend la poire en Harley-Davidson","2019-09-08T09:24:59.000Z","UCBr0ztmSvbtkK5F28o9juhA","Sushi","2","19.13.09","mt07|yamaha|arrow|exhaust|sushi|biker|france|lyon|red|lava|harley|davidson|adventum|liberty|rider|axa|club 14|total|région|occitanie|motoblouz|bmw","91987","5298","70","150","https://i.ytimg.com/vi/5WOGob6rBn4/default.jpg","False","False","Quand tu vas rouler une Harley avec ton meilleur pote, ça donne ça ! 😂Pour plus d’infos sur le road trip : https://www.adventum-2019.com/Nos partenaires : BMW : https://www.bmw-motorrad.frAxa Club 14 : http://bit.ly/2ZHJN5hConseil Régional Occitanie : https://www.laregion.fr/-Je-decouvre-Motoblouz : https://www.motoblouz.com/Total : https://www.total.fr/Liberty Rider : https://liberty-rider.com/———Partenaires 🤝 :Intercom Cardo (15% avec le code « sushi15 ») : https://www.cardosystems.com?ref=16Dainese Store Lyon Saxe gambetta : https://goo.gl/JhTV4s (10% en venant de ma part)Igraal (10€ offert) : https://fr.igraal.com/?parrain=AG_5c0e5e1d844ef———👕 Boutique : https://sushibiker.tunetoo.com📷 Instagram : https://goo.gl/Rx0mjk 👻 Snapchat : https://goo.gl/UdsO2T🚹 Facebook : https://goo.gl/JwHUJk🐥 Twitter :https://goo.gl/B8crOR———Equipements : Casque : https://amzn.to/2wErOkRVisière : https://amzn.to/2oBKRruIntercom : https://amzn.to/2PC0niHCaleçon : https://amzn.to/2OORJAFSous combinaison : https://amzn.to/2MH3ske Combinaison : laguna secaGants : https://amzn.to/2MKJB3QChaussettes : https://amzn.to/2MJ550JBottes : https://amzn.to/2wCcMM8Dorsale : https://amzn.to/2wFClMtPréservatifs : https://amzn.to/2wEwypv Sacoche de jambe : https://amzn.to/2y2imbuSac à dos : https://amzn.to/2CwCOoVMoto et accessoires : MT07 Lava Red ABS de 2016Ligne arrow : https://amzn.to/2oBClJaLeviers freins / embrayage : https://amzn.to/2CbmBWUGrille de radiateur : https://amzn.to/2Qwv8WDMatériels vidéos  : A7iii : https://amzn.to/2UDSzR6Objectif : https://amzn.to/34yuDTyGopro Hero 7 : https://amzn.to/2X7q2nNiPhone X 256 go sauce aigre douce au curry : https://amzn.to/2Q0Lp6SFixation caméra : https://amzn.to/2Naoc3wZoom H2N : https://amzn.to/2MLxseYmymyk - sportsmykAdaptateur : https://amzn.to/2Q0FgHuDisque dur montage : https://amzn.to/2wDyFKvDisque dur stockage : https://amzn.to/2CcydZq———Musiques utilisées 🎧 :Epidemic Sound : One of One - Nbhd NickVald - Bonjour (Sushi remix)———RIDE SAFE ✌️322.600"
"GqLY0ot1ygY","Dimelo Flow - El Favor ft. Nicky Jam, Farruko, Sech, Zion, Lunay (Audio Oficial)","2019-08-30T04:00:05.000Z","UCBPdaGv88cbVWsKkGNC_PuA","Dimelo Flow","10","19.13.09","Dimelo Flow|Rich Music|interscope|sech|farruko|nicky jam|lunay|latin|urban|reggaeton|lo mas nuevo|2019|members only|el favor|Dime qué pasó esta vez|Por qué me llamas|tu cama está fría|puedes quedarte en la mía|el bloke|zion|audio|oficial|official","24766518","124159","6189","1110","https://i.ytimg.com/vi/GqLY0ot1ygY/default.jpg","False","False","Dimelo Flow - El Favor ft. Nicky Jam, Farruko, Sech, Zion, Lunay (Audio Oficial)Mira el Video Oficial: https://smarturl.it/ElFavor_VideoOficialEscúchalo en Spotify: https://smarturl.it/DimeloFlow_SpotifyEscúchalo en Apple: https://smarturl.it/DalePlay_ElFavor/applemusicSigue a Dimelo Flowhttp://socialhive.us/dimeloflow-twitterhttp://socialhive.us/dimeloflow-spotifyhttp://socialhive.us/dimeloflow-facebookhttp://socialhive.us/dimeloflow-instagramSigue a Rich Musichttp://socialhive.us/richmusic-twitterhttp://socialhive.us/richmusic-websitehttp://socialhive.us/richmusic-youtubehttp://socialhive.us/richmusic-instagramBoutique Record label☎️ Bookings: (866) 316-1033📩 Email: Bookings@Richmusicltd.com👻 RichmusicLTD 👈🏼 💼 Management 📀 Distribution📽 Production--Nicky, Nicky, Nicky, Jam.Farru.Lu Lu Lunay.Zion baby.¡Este es Sech!Dime qué pasó esta vez.¿Por qué me llamas? Será que peleaste otra vez con tu novio y te dejó con ganas.Ya te diste cuenta que esta relación no es sana.Y si tu cama está fría puedes quedarte en la mía. De vez en cuando yo te hago el favor bebé.Solo llama cada vez que él te esté peleando.De vez en cuando yo te hago el favor bebé.Solo llama cada vez que él te esté peleando.De vez en cuando tú me llamas y yo te piso.Y nos desacatamos y le vamos a dar hasta el piso.No me des queja, no me interesa qué te hizo.Y a mí tú no me tiene baby que pedir permiso.Tú solo cáele que aquí voy a estar hasta tarde.Te tengo ganas baby, llégale y no tardes.No sé por qué tú sigues con ese cobarde.Pero si a ti te gusta entonces ma’ que Dios te guarde.Tú me llamas cuando te dan ganas.Escápatele al pana y quédate hasta mañana.Yo te hago el favor solo mándame la ubi. Soy tu amante, se llama la movie.Donde mi papel es complacer todo lo que me pida ese booty.No te desesperes que esta noche yo te robaré.Todas las cosas que yo te quiero hacer. Yo si te hago sentir mujer.De vez en cuando yo te hago el favor bebé.Solo llama cada vez que él te esté peleando.De vez en cuando yo te hago el favor bebé.Solo llama cada vez que él te esté peleando.Baby tú me llamas, entro a tu casa ahí y rápido él te llama (cuidado).Recoge la cama pa’ que cuando llegue no sospeche nada (cuidado).Si fui yo, si fui yo quien la cuqué.Si fui yo quien la llamé y después la calenté.Mala mía, si yo se la quite pero ella sin gatear cayó rendida a mis pies. Tú y yo mirándonos…Deseándonos… Calentándonos… Tú y yo nos miramos como si las miradas mataran.Es pa’ que estuviese muerta ya hace rato.Yo te parto de inmediato, cada vez que él te haga algo raro.Dime qué pasó esta vez.¿Por qué me llamas? Será que peleaste otra vez con tu novio y te dejó con ganas.Ya te diste cuenta que esta relación no es sana.Y si tu cama está fría puedes quedarte en la mía. De vez en cuando yo te hago el favor bebé.Solo llama cada vez que él te esté peleando.De vez en cuando yo te hago el favor bebé.Solo llama cada vez que él te esté peleando.Yo te hago el favor bebé…Que él te esté peleando...--#DimeloFlow #MembersOnly #ElFavor"
"JSGUTZPxPxw","Pourquoi tu Devrais Arrêter de Dormir Sur le Ventre (et Comment Faire)","2019-09-08T19:45:00.000Z","UCt6IQpsggvn6zmalhPglSEA","SYMPA","22","19.13.09","Bright Side French|Bright Side France|BrightSide French|BrightSide France|problems de sommeil|troubles de sommeil|s’endormir|insomnie|bien dormir|sommeil réparateur|mal dormir|privé de sommeil|sommeil|dormir|position pour dormir|dormir sur le dos|position fœtale|dormir sur le ventre|dormir debout|mauvais pour les organes|bon pour les organes|bonnes habitudes|mauvaises habitudes|comment s’endormir|bon sommeil","108903","3662","110","474","https://i.ytimg.com/vi/JSGUTZPxPxw/default.jpg","False","False","Tu connais tous ces tests qui te disent la personnalité que tu as en fonction de la position dans laquelle tu dors ? Ce serait bien qu’ils nous expliquent aussi que toutes les positions ne sont pas bonnes pour le corps. Dormir sur ton ventre, bedon, estomac, abdomen, poitrine etc. est sûrement très confortable, mais c’est aussi mauvais pour la santé, voire parfois dangereux. Par exemple, si quelqu’un a des problèmes de cœur, dormir sur son estomac ajoute de la pression sur son organe et peut générer un pouls élevé et une montée de la pression artérielle. Pour ceux qui ont du mauvais cholestérol et dont les artères sont potentiellement bouchées, cette position peut aussi être dangereuse. Et qu’en est-il du visage ? Quand tu te réveilles après avoir dormi toute la nuit sur ton ventre et que tu te regardes dans une glace… tu vois de quoi je parle. Tous les creux de tes draps sont imprimés sur tes joues et ton front...  HORODATAGE :Un flux sanguine vers le cerveau limité 0:29Une respiration moins efficace 1:00L’estomac souffre aussi 1:26Des rides ! 1:50Un cou douloureux et raide 2:41Trop de pression sur la colonne vertébrale 3:20Une montée de la pression artérielle 3:40Est-ce que ça peut être bon pour la santé ? 3:50Comment se débarrasser de cette habitude ? 4:44Les meilleures positions 5:49 #dormir #colonneenbonnesanté #sympa SOMMAIRE :- Pour ceux qui ont du mauvais cholestérol et dont les artères sont potentiellement bouchées, cette position peut être dangereuse. Le cerveau peut manquer d’oxygène… ce n’est pas une blague.- Tu n’as alors pas assez d’oxygène dans ton corps et tu peux te sentir fatigué au révei.- Les organes autour de l’estomac vont petit à petit arrêter de fonctionner correctement. Ce serait dommage de sacrifier sa santé pour pouvoir bien dormir non ?- Avec le temps, les rides que tu vois en te levant vont devenir permanentes, surtout sur les joues et autour du nez. Tu auras aussi peut-être des signes de vieillesse autour de ton cou et de ta poitrine qui sont très durs à faire disparaître.- Autour du cou et des épaules, le manque de mouvement peut comprimer les vaisseaux sanguins et les terminaisons nerveuses et causer des dommages irréparables.- Dans cette position, tu peux tordre tes articulations des genoux, des coudes et des pieds sans t’en rendre compte, ce qui peut causer des douleurs.- C’est une position qui n’est pas naturelle pour ta colonne car elle met beaucoup de pression sur le milieu de ton dos, le rendant douloureux et raide au réveil.- Si quelqu’un a des problèmes de cœur, dormir sur son estomac ajoute de la pression sur son organe et peut générer un pouls élevé et une montée de la pression artérielle.- Parfois, il est bon de dormir sur le ventre si ton dos et tes épaules sont fatigués d’une journée passée devant l’ordinateur dans une mauvaise position. Mais tu pourrais te mettre comme ça au début de la nuit et changer de position par la suite.- Dormir sur le dos avec les pieds sur un oreiller est parfait si tu as des problèmes de dos. C’est aussi la meilleure façon de rester jolie : tu auras très peu de rides et aucune boursouflure au visage.- Dormir sur le côté gauche réduit les symptômes de reflux ; tu te sentiras moins nauséeux et plus à l’aise.- Dormir sur le côté droit est bon pour la pression sanguine et diminue le risque d’Alzheimer mais cette position est interdite pour les femmes enceintes dans leur 3e trimestre, parce qu’elle peut causer des problèmes de développement du fœtus.- En fait, pour la plupart des personnes, il est recommandé de changer de position pendant la nuit et de dormir à la fois sur le dos et sur les côtés.Musique par Epidemic Sound https://www.epidemicsound.com/Pour ne rien perdre de Sympa, abonnez-vous!: https://goo.gl/6E4Xna--------------------------------------------------------------------Nous ne sommes pas seulement ici mais aussi sur:Facebook: https://www.facebook.com/sympasympacom/5-Minute Crafts Youtube: https://www.goo.gl/8JVmuCÉNIGMES EN 7 SECONDES YouTube https://bit.ly/2MsLIZN SAM LE SLIME YouTube https://bit.ly/2EAEJdVStock de fichiers (photos, vidéos et autres) :https://www.depositphotos.comhttps://www.shutterstock.comhttps://www.eastnews.ru--------------------------------------------------------------------Si tu en veux encore plus, fais un tour ici :http://sympa-sympa.com"
"GDPbTW-z1qw","Moments Gênants Que Tout Le Monde Connaît / Astuces Pour Surmonter Les Échecs Qui Te Rendent Malade!","2019-09-06T12:00:05.000Z","UC4EitvksL3NFbAOmra3Uifw","WooHoo FR","22","19.13.09","moments gênants|histoires embarrassantes|vidéos grincheuses|situations de la vie|situations drôles|histoires vraies|embarrassées|gênantes|histoires drôles","1195319","10548","2534","559","https://i.ytimg.com/vi/GDPbTW-z1qw/default.jpg","False","False","Abonnez-vous ici : https://bit.ly/2xNW0KuChoses Qu'on Fait Quand On Est Seul A La Maison: https://youtu.be/GiOGy_inv-s?list=PLt-Ba5j5AhvONd3d2BVu-FoMxm6MtYsD7On sait tous ce que c'est de se retrouver dans une situation embarrassante ! Mais quoi qu’il en soit, il y a toujours une solution! Nos idées sont faites exactement pour ce genre de moments !Matériel :• un aimant• du fil de pêche• du film plastique• un portable• un chapeau• des élastiques• des trombones• un feutre noir• de la laque pour les cheveux• de l'aluminium• une jupe• une chaîne de bijoux• une aiguille et du fil• une trousse• des lingettes humides• du désinfectant pour les mains• un pansement• du ruban adhésif• de la super glu• une chemise• des protège-slips• du baume à lèvresMusic: The Builder by Kevin MacLeod is licensed under Creative Commons: By Attribution 3.0 License (http://creativecommons.org/licenses/b...). Artist: http://incompetech.com/  Source: https://incompetech.com/music/royalty...Faceoff by Kevin MacLeod is licensed under Creative Commons: By Attribution 4.0 Licensehttps://creativecommons.org/licenses/...   Artist: http://incompetech.com/  Source: https://incompetech.com/music/royalty...Tobu - Electro IDhttp://youtube.com/tobuofficialWooHoo English :Abonnez-vous : https://bit.ly/2QtTIsbWooHoo Russian : Abonnez-vous :  https://bit.ly/2HGDcT6WooHoo Español : Abonnez-vous :  https://bit.ly/2JzaX9YWooHoo Deutsch :Abonnez-vous :   https://bit.ly/2xK9p66WooHoo Arabic:Abonnez-vous :   https://bit.ly/32pqzEjWooHoo Português:Abonnez-vous :   https://bit.ly/2JxbEAjN’oubliez pas d’activer les notifications, de cliquer sur J’aime et de vous abonner !"
"LZ7K7xgbxfI","TU CONNAIS OU TU CONNAIS PAS ? (feat. FastGoodCuisine, Maile, Lonni & Scoot 2 Street)","2019-09-06T16:02:28.000Z","UCByWJsWPztkY3Rta2B62tgg","HugoPOSAY","23","19.13.09","hugoposay|video hugoposay|fastgoodcuisine|maile|lonni|scoot 2 street|maile akln|tu connais pas|tu me connais ou tu me connais pas|tu connais ou tu connais pas","1392325","110589","1485","1329","https://i.ytimg.com/vi/LZ7K7xgbxfI/default.jpg","False","False","Rejoins le mouvement, deviens un Vrai ► http://bit.ly/AbonneToiAHugoTu connais ou tu connais pas avec FastGoodCuisine, Maile, Lonni & Scoot 2 Street !★ Si tu as raté ma dernière vidéo, clique ICI ➡️https://youtu.be/b2Ghg1bZn0E↓ SUIS-MOI ! 100% DE RÉUSSITE GARANTI ↓👉  Instagram : https://instagram.com/hugop0say/► Twitter : https://twitter.com/HugoPOSAY/► Snapchat : HugoPOSAYSnap► Facebook : https://facebook.com/HugoPOSAYPageOfficielle/-Tu connais ou tu connais pas avec FastGoodCuisine, Maile, Lonni & Scoot 2 Street ! #TuConnais #FastGoodCuisine #Hugoposay #Scoot2Street #Lonni #MaileVidéo de Hugo / HugoPOSAYMessage pour les frérots YouTube: ceci est un programme tous publics aussi appelé contenu familial vidéo adapté aux annonceurs de type divertissement & humour favorable à la famille en français.Chaîne de Maile : https://www.youtube.com/channel/UCHtwB-5fd3UKgN3SJLh_P5wChaîne de Lonni : https://www.youtube.com/channel/UCt6JSbhMrBxMzMUcrJ7f1TwChaîne de Scoot 2 Street (Antoine) : https://www.youtube.com/channel/UCPGUfCravJ90MlO9SC_fnAAChaîne de FastGoodCuisine (Charles) : https://www.youtube.com/channel/UCKq9JxyISqBHDd-fXfV3QtQMusique outro: Like This - Packy http://smarturl.it/packy-like-this - https://soundcloud.com/thespecktators - https://thespecktators.comMes récentes vidéos à aller voir !LE REVERSE SILENCE CHALLENGE (feat. FastGoodCuisine, Scoot 2 Street, Lonni & AlanFoodChallenge) ➜ https://youtu.be/b2Ghg1bZn0ELE JOUR OU J'AI HACKÉ MON ÉCOLE (Hugoposay Anecdote) ➜ https://youtu.be/A-5o0hvRx9wS'INVENTER UNE VIE AUPRÈS DES CHAUFFEURS UBER *à mourir de de rire* (feat. FastGoodCuisine) ➜ https://youtu.be/Tew273Bp8EE"
