video_id,title,publishedAt,channelId,channelTitle,categoryId,trending_date,tags,view_count,likes,dislikes,comment_count,thumbnail_link,comments_disabled,ratings_disabled,description
"leopt__ATR0","Ariana Grande, Miley Cyrus, Lana Del Rey - Don’t Call Me Angel (Charlie’s Angels)","2019-09-13T04:00:12.000Z","UC0VOyT2OCBKdQhF3BAbZ-1g","ArianaGrandeVevo","10","19.13.09","Ariana|Grande|Miley|Cyrus|Lana|Del|Rey|Don’t|Call|Me|Angel|(Charlie’s|Angels)|Republic|Records|Soundtrack","12372795","1582033","66921","116174","https://i.ytimg.com/vi/leopt__ATR0/default.jpg","False","False","Official music video by Ariana Grande, Miley Cyrus, Lana Del Rey performing “Don’t Call Me Angel (Charlie’s Angels)” – available now: https://charliesangels.lnk.to/dcmaYD►Follow Charlie’s Angels OnlineAdvanced Tickets: https://www.charliesangels.movie/tickets/?hs308=AG Watch Trailer: https://www.youtube.com/watch?v=RSUq4VfWfjE&t=52sInstagram: https://www.instagram.com/charliesangels/Facebook: https://www.facebook.com/CharliesAngels/Twitter: https://twitter.com/CharliesAngelsWebsite: https://www.charliesangels.movie/?hs308=AG►Follow Ariana Grande OnlineInstagram: https://www.instagram.com/arianagrande Facebook: https://www.facebook.com/arianagrande/ Twitter: https://twitter.com/ArianaGrande Website: https://www.arianagrande.com/ ►Follow Miley Cyrus OnlineInstagram: https://www.instagram.com/mileycyrusFacebook: https://www.facebook.com/MileyCyrusTwitter: https://twitter.com/MileyCyrusWebsite: https://mileycyrus.com/►Follow Lana Del Rey OnlineInstagram: https://www.instagram.com/lanadelrey/Facebook: https://www.facebook.com/lanadelreyTwitter: https://twitter.com/lanadelrey Website: https://lanadelrey.com/Video Director: Hannah Lux DavisVideo Producer: Brandon Bonfigliofor London Alley#CharliesAngels #DontCallMeAngelMusic video by Ariana Grande, Miley Cyrus, Lana Del Rey performing Don’t Call Me Angel (Charlie’s Angels). © 2019 Republic Records, a division of UMG Recordings, Inc. Motion Picture Artwork © CTMG.  All Rights Reserved."
"FmcNr5Z3wWQ","Gusttavo Lima - Quem Traiu Levou - DVD O Embaixador In Cariri (Ao Vivo)","2019-09-12T14:01:18.000Z","UCXooz9whNJZBRTHi9AqdjPw","Gusttavo Lima Oficial","10","19.13.09","Slap Música|Arrocha|Música Sertaneja (Musical Genre)|Pop|Gustavo Lima|Gusttavo Lima|Gatinha Assanhada|Tchererê Tche Tche|Sony|Sony Music|Buteco|Buteco do Gusttavo Lima|Buteco do Gusttavo Lima 2|O Embaixador|Homem de Família|Abre o Portão Que Eu Cheguei|Que Pena Que Acabou|Apelido Carinhoso|Na Hora de Amar|Mil Vezes Cantarei|Cem Mil|Eu Não Iria|Sujeito|Carrinho na Areia|Milu|O Embaixador In Cariri|Cariri|Quem Traiu Levou","2048993","173743","1838","7762","https://i.ytimg.com/vi/FmcNr5Z3wWQ/default.jpg","False","False","#GusttavoLima #QuemTraiuLevou #OEmbaixadorEssa música faz parte do novo álbum do Gusttavo Lima, O Embaixador In Cariri, gravado em Crato/CE.INSCREVA-SE NO CANAL: http://tinyurl.com/youtubeGLCOMPRE E OUÇA: https://smb.lnk.to/QuemTraiuLevouProdução: Gusttavo Lima e Newton FonsecaDireção: Anselmo TroncosoCompositores: Gusttavo Lima / Denner Ferrari / Felipe Goffi / Waléria Leão / Blener MaycomGravadora: Sony MusicQUEM TRAIU LEVOUNão to jogando pragaSe tratando de amorAqui se faz aqui se pagaVai preparando pra latadaO que eu bebi, cê vai beberO que eu sofri, cê vai sofrerVai ver quanto custaAmar alguém que não vale nadaTraição uma hora tem voltaEla vem e não bate na portaTo aqui ansioso esperando sua vez chegarOh, oh, oh, ohQuem traiu levouDesde que o mundo é mundo isso é regraVem na mesma moeda dobrado o valorOh, oh, oh, ohQuem traiu levouÔ benzinho eu não quero o seu malSó sei que no final vai sorrir quem chorouSiga Gusttavo Lima nas redes sociais!Facebook: https://www.facebook.com/gusttavolimaoficial/Youtube: https://www.youtube.com/gusttavolimaoficialInstagram: https://www.instagram.com/gusttavolima/Twitter: https://twitter.com/gusttavo_limaSite: http://gusttavolima.com.br/"
"bKi0LDj5SKo","As Aventuras de Poliana | capítulo 347 - 12/09/19, completo","2019-09-13T00:54:37.000Z","UCvgfiEUr4w7DaCyEoxkdkOw","As Aventuras de Poliana","24","19.13.09","as aventuras de poliana|poliana|novela poliana|poliana sbt|sophia valverde poliana|assistir poliana|vilões novela poliana|sbt novela|aventuras de poliana|aventuras poliana|pollyana|poliana novela|sbt poliana|chamada poliana|assistir novela poliana|as aventuras de poliana de hoje|as aventuras de poliana de ontem|capítulo de ontem|episódio completo|poliana 347|capítulo do dia 12/09/19|poliana ao vivo","1407554","86321","1641","4758","https://i.ytimg.com/vi/bKi0LDj5SKo/default.jpg","False","False","Escrita pela autora Iris Abravanel e com a direção-geral de Reynaldo Boury, a nova novela do SBT, As Aventuras de Poliana, é uma história inspirada no clássico da literatura infantojuvenil de 1913, Pollyana, de Eleanor H. Porter. A novela conta a história de Poliana, uma garota que ao perder os pais, se muda para São Paulo para viver com sua tia, a Luísa.  A garota sonha em estudar na escola Ruth Goulart e lá vai fazer muitos amigos!NOS ACOMPANHE NAS REDES SOCIAISAcesse o site oficial: https://www.sbt.com.br/novelas/as-aventuras-de-polianaCanal oficial da novela As Aventuras de Poliana!Curta nossa página no Facebook: https://www.facebook.com/AsAventurasDePolianaNos siga no Twitter: https://twitter.com/SBT_PolianaAcompanhe os bastidores em nosso Instagram: @asaventurasdepoliana"
"EMTK5tqCmTc","MINHA MÃE VEIO VISITAR A GENTE NA CASA NOVA❤️","2019-09-12T22:48:32.000Z","UC9eXFedzizQtlY5snZ-IFkg","Sunaika Bruna","24","19.13.09","minha mae veio visitar a gente na casa nova|casa nova|visita casa nova|sunaika bruna|sunaika souza|souza sunaika","471587","92833","298","1532","https://i.ytimg.com/vi/EMTK5tqCmTc/default.jpg","False","False","Minha mãe veio visitar a genteeee!!! Até que enfimmmmmm......E ai eu decidi fazer uma surpresa pra ela com uma mesa de café da manhã! espero que gostem do vídeo 🙈🙈Já aproveita e deixa seu like 👍🏻 e se inscreva no canal se ainda não for inscrito🥰🥰"
"zf_R0VgJAwM","SCOOBY REVELA SOFRIMENTO APÓS TÉRMINO COM ANITTA EM ENTREVISTA A LEO DIAS","2019-09-12T12:40:14.000Z","UCVFbXI6Gu8U2f9Gjtxw4A-Q","UOL","25","19.13.09","uol|noticia|notícias|reportagem|tvuol|entretenimento|pedro scooby|leo dias|léo dias|rio de janeiro|praia da reserva|surfista|surf|anitta|relacionamento|término|final|celebridades|scooby|pedro scooby anitta|anita scooby|leo dias entrevista scooby|entrevista scooby|leo dias e scooby|pedro scooby uol|scooby uol|scooby anitta telefone|scooby sofrimento|scooby sofrimento anitta|leo dias anitta|leo dias scooby uol|uol leo dias|leo dias entrevista","475207","19731","1805","5437","https://i.ytimg.com/vi/zf_R0VgJAwM/default.jpg","False","False","Não tenho tempo para pensar em tristeza. Em entrevista exclusiva ao UOL, gravada na Praia da Reserva, no Rio de Janeiro, o surfista Pedro Scooby falou sobre o término do namoro com Anitta.Revelou que a cantora deu fim ao relacionamento por telefone, dizendo que precisava de um tempo. Eu respeito. As pessoas têm os seus motivos. Eu não debati. Scooby ainda fez um balanço e assumiu que tentou, na relação com Anitta, corrigir erros que cometeu no passado com a ex-mulher, Luana Piovani.E disse que, talvez por ter se dedicado tanto ao relacionamento --sem saber dizer não à cantora--, o término tenha sido inevitável. Eu me doei muito, fui muito intenso, muito verdadeiro, muito muito presente, muito carinhoso, muito atencioso, avalia. Nunca disse não.-------------------------Bem-vindo ao canal do UOL no YouTube. Aqui você encontra notícias direto da redação, tudo sobre política, matérias especiais e o melhor do mundo do entretenimento. ** INSCREVA-SE NO CANAL: http://bit.ly/2xolCQ2"
"sOEUfUu35JM","ELE DESCOBRIU QUE TINHA PERDIDO A CARTEIRA NA HORA DE PAGAR A CONTA- Ep. 1396","2019-09-12T21:00:11.000Z","UCtrjFP7i92_30uv6IehwE5Q","Cadê a chave?","24","19.13.09","Leon|Martins|Nilce|Moretto|nilmoretto|leon|intercambio|intercâmbio|imigrar|br|pt|ptbr|canada|esquecimento|carteira|celular|passaporte|comida japonesa|sushi|sashimi|gastronomia|vlog|urbano|cidade|melhor cidade pra se viver|brasileiros em vancouver|brasileiros no canada","285603","49526","285","1100","https://i.ytimg.com/vi/sOEUfUu35JM/default.jpg","False","False","Camisas Coisa de Nerd  http://bit.ly/2arsmPrCamisas Coisa de Nerd para Portugal: https://bit.ly/2tIiHxsSnapchat do CAC: cadeachaveFACEBOOK do CAC: https://facebook.com/kdchaveInstagram do Leon: https://instagram.com/cdnleonCanal CoisadeNerd (GAMES) https://youtube.com/coisadenerdFacebook do Leon: https://facebook.com/coisadenerdTwitter da Nilce: https://twitter.com/nilmorettoInstagram da Nilce:  https://instagram.com/nilmorettoMusic by: Epidemic Sound www.epidemicsound.comYoutube (Ferramentas de Criação) Pacote Royalty Free do Sony Vegas"
"KlGqR8jLYbI","NOVO CHEVROLET ONIX E ONIX PLUS 2020 - Detalhes da NOVA GERAÇÃO em PRIMEIRA MÃO! | Top Speed","2019-09-12T17:18:22.000Z","UCzySGyh1QVkPar3ZjV0TiZA","Top Speed","2","19.13.09","onix|novo onix|onix 2020|onix plus|novo onix detalhe em primeira mao|leozitor|top speed|novo onix 2020|novo chevrolet onix|chevrolet|hatch compacto|carro mais vendido|menos nunca mais","200156","10967","176","1036","https://i.ytimg.com/vi/KlGqR8jLYbI/default.jpg","False","False","A convite da Chevrolet do Brasil, viemos até Porto Alegre para conhecer o novo Onix 2020, o compacto que subiu de categoria e traz uma série de novidades em toda a linha, desde plataforma modular até motorização Turbo.Preços:Onix LT 1.0 - R$ 51.590Onix LTZ 1.0 Turbo - R$ 66.290Onix Plus LT 1.0 Turbo - R$ 61.990Onix Plus LTZ 1.0 Turbo - R$ 70.990Tá curioso(a) para conhece-lo? Então...Acompanhe!Procurando um site de classificados confiável e com uma ampla gama de anúncios? O Top Speed recomenda a Mobiauto.Acesse: www.mobiauto.com.br e confira!Inscreva-se no Top Speed para receber vídeos automotivos, motociclísticos e dicas: http://goo.gl/fZMHQj  Instagram: https://instagr.am/canaltopspeedWebsite: http://www.topspeed.com.br"
"0MEE0TsScSo","Vagner Love: “Nasci flamenguista, mas virei corinthiano” - BTS #170","2019-09-12T22:00:38.000Z","UCFjrDmEnxrG5TRGVO0TPHLA","Desimpedidos","17","19.13.09","desimpedidos|bolivia|futebol humor|futebol|zueira|gol|golaço|soccer|mitagem|dibre|drible|time|disimpedidos|disimpididos|desimpididos|Vagner Love|BTS|Bolívia Talk Show|Bolívia Desimpedidos|Corinthians|Entrevista BTS|Du Meneses ESPN|Vagner Love Flamengo|Maracanã|Palmeiras|Copa São Paulo|Vagner Love entrevista|Renata Fan|Clayson Corinthians|Vagner Love agredido|Vagner Love Rússia|Malcom racismo|Tite|Vagner Love China|Adriano Imperador|Jô atacante|André balada","260077","41714","399","1377","https://i.ytimg.com/vi/0MEE0TsScSo/default.jpg","False","False","Demorou mas o homem tá aqui, Brasil! O BTS de hoje é com ele: o artilheiro do amor, atacante do Corinthians e desenrolado na resenha! O Bolivão trombou o Vagner Love na Arena Tango, da Adidas, e trocou uma ideia fera com o jogador, que admitiu ter deixado de ser flamenguista pra torcer pelo Timão! Segue a gente no Insta: http://bit.ly/2Sb4vbTCOMPRE O ALMANAQUE DESIMPEDIDOSAmazon - https://amzn.to/2NPe0uLLivraria Curitiba - http://bit.ly/2LmDIFwPanda Books - https://bit.ly/2NQiWQ7Este é o canal Desimpedidos. Pra quem ama futebol e zueira sem  limites, aqui  seu time é pequeno, o Paulo Baier é deus e o Cristiano Ronaldo é só mais um. CONTATO: contato@desimpedidos.com.br / imprensa@nwb.com.br--------------------------Experimente 1 mês grátis do banco de trilhas Epidemic Sound: http://bit.ly/epidemicnwb-------------------------Segue a gente no IG: @desimpedidos / @nwb.oficialCréditos: Gazeta PressArquivo PessoalGuilherme Costa/ Futura PressRubens Chiri/ Gazeta PressCristiano Estrela/ Diário CatarinenseMarcos Ribolli/ GLOBOESPORTEAFPCleber Mendes/ Agencia Lance!Aleksander Nemenov/ AFPNatalia Kolesnikova/ aFPTASSIvo Gonzalez/ Ag. O GloboMarcos Alves/ Ag. o GLOBO/ ArquivoAlexandre Durão/ FlamengoAri Ferreira/ Lancepress!Daniel Vorley/ AGIFDanilo Fernandes/ Meu TimãoEduardo caRMIM/ pHOTOARENA/ FolhapressGiuseppe Cacace/ AFPVanderlei Almeida/ aFPAPDRNelson Antoine/ APDaniel Augusto Jr./ CorinthiansPatrick Stollarz/ AFPFernando Dantas/ Gazeta PressMANAN VATSYAYANA/ AFPVIPCOMMALEXANDRE VIDAL/ FLA IMAGEM"
"3JP4PqKEglw","Jornal da Manhã 2a. Edição - 13/09/19","2019-09-13T18:30:14.000Z","UCP391YRAjSOdM_bwievgaZA","Jovem Pan News","25","19.13.09","[none]","125653","4525","189","1","https://i.ytimg.com/vi/3JP4PqKEglw/default.jpg","False","False","Inscreva-se no nosso canal:http://www.youtube.com/c/jovempannewsEntre no nosso site:http://jovempan.com.br/Facebook:https://www.facebook.com/jovempannewsSiga no Twitter:https://twitter.com/JovemPanNewsInstagram:https://www.instagram.com/jovempannewsoficial/#JovemPan"
"FHY_wYmVOAQ","COMPREI UM BARCO NOVO PARA MEU PAI","2019-09-12T14:45:00.000Z","UChMJkHCD2wdvSO7CMOuLR-w","Renato Garcia","24","19.13.09","RENATO GARCIA|RENATO DA XJ6|RENATO|CAMARO|DAILY VLOG|barco pai|barco|barco de pesca|pai|pai do renato garcia|renato garcia barco","1043698","274794","1993","3928","https://i.ytimg.com/vi/FHY_wYmVOAQ/default.jpg","False","False","Estou devendo um barco com motor para meu pai faz algum tempo, então finalmente dei o presente dele ! Minha Loja: https://www.lojarenatogarcia.com.br/MercadoLivre: https://eshops.mercadolivre.com.br/LOJARENATOGARCIA ●Instagram: https://www.instagram.com/renatogarciayt●Twitter: https://twitter.com/renatogarciayt●Facebook: https://www.facebook.com/renatogarciayoutubeME ENVIE PRESENTES ! Caixa Postal: 8748CEP: 86020980LONDRINA - PR MEU SEGUNDO CANAL: https://www.youtube.com/channel/UClUN2J5hwEsE6_sKW3SPlMg●Contato para parcerias e eventos: renatogarcia.comercial@gmail.com"
"bWWt5nE02P0","MAMATA","2019-09-12T14:00:11.000Z","UCEWHPFNilsT0IfQfutVzsag","Porta dos Fundos","24","19.13.09","porta dos fundos|kibe loco|fabio porchat|gregorio duviver|ian sbf|antonio tabet|joão vicente de castro|comedia|humor|engraçado|funny|comedy|risos|risadas|hilario|bizarro|parodia|satira|cotidiano|o limite do humor|política|lei rouanet|lei ruanet|uber|fernanda montenegro|djavan|milton nascimento|serviços|instalação|bandido|bandidagem|ator|atriz|cinema|teatro|artista|bituca|anitta|caetano|gilberto gil|segurança|criminalidade|polícia|marieta severo|peça|juiz|moro|crime","913651","111381","4072","2511","https://i.ytimg.com/vi/bWWt5nE02P0/default.jpg","False","False","Gilberto Passos Gil MoreiraCasado77 anosSalvador/BAExperiência: - Participações em festivais (1966)- Intercâmbio em Londres (1968)- Ministro da Cultura (2003)- Ganhador de prêmios GrammyObjetivos: Estou disponível para trabalhar com criação de websites, homepages, com quantos gigabytes que se faz uma jangada, um barco que veleje. Também trabalho com animação de eventos. Trago a minha banda. Só quem sabe onde é Luanda saberá lhe dar valor. Como hobby, faço doces de produção artesanal, como marmelada de banana, bananada de goiaba, goiabada de marmelo.ELENCOAntonio TabetRafael PortugalStepan NercessianJoão Vicente de CastroGregório DuvivierMAKING OF: https://youtu.be/svI36AWkjXoBAIXE O APP DO PORTAAndroid: http://bit.ly/2zcxLZOiOS: https://apple.co/2IW633jTRADUÇÃO E LEGENDAGEMDispositivaJosniel RodriguezEsse é o canal Porta dos Fundos. Lançamos vídeos todas as segundas, quintas e sábados às 11h."
"4zipuWn0p7o","ÉVERTON RIBEIRO: GABIGOL e BRUNO HENRIQUE são os MELHORES do FLAMENGO - Alê Oliveira Responde #104","2019-09-12T22:00:00.000Z","UCzRvM45jcCvVFsxhbvSHp-Q","De Sola","17","19.13.09","humor esportivo|ale oliveira|de sola|ale oliveira responde|ale oliveira de sola|everton de sola|everton ribeiro de sola|everton ribeiro flamengo|everton ribeiro 2019|everton ribeiro entrevista|ale oliveira entrevista|ale oliveira everton ribeiro|gabigol|everton ribeiro gabigol|bruno henrique|melhores flamengo|flamengo|gabigol flamengo|bruno henrique flamengo|ale oliveira resenha|everton ribeiro meia|flamengo x emelec|flamengo entrevista","181557","27017","130","753","https://i.ytimg.com/vi/4zipuWn0p7o/default.jpg","False","False","Quer ganhar uma viagem COM TUDO PAGO para assistir à semifinal da Champions? Baixe o Fanáticos e concorra: http://bit.ly/2lx4WRrNessa semana, o mito Alê Oliveira recebe Éverton Ribeiro. Na entrevista teve o meia falando da torcida, emoção de jogar do Fla, e muito mais! Chega mais, curte essa RESENHA MONSTRA, se inscreve no canal e deixa o like no vídeo que ajuda muito a gente!Já viram o novo Instagram do De Sola? Clica no link http://bit.ly/2SlIKox, que tem post zoando todos os times e stories com Casimiro, Certezas e Alê!!!Veja as últimas entrevistas do Alê, só clicar no link:Gabigol - https://bit.ly/2lygLXJMuricy - https://bit.ly/2Uij8LlWillian Arão - https://bit.ly/2NtxHdFPrograma 100 - https://bit.ly/2Lg0YWLFalcão - https://bit.ly/2MzbI5CProdução: Lucas Vechi e Túlio SchuwenckEdição: Julio Penhasko e Fernando MotaImagens: Leandro Sant'AnnaSiga as redes sociais do Alê Oliveira:Facebook - Ale OliveiraInstagram - ale_oliveiraoficialTwitter - Ale_oliveiraoficialPROGRAMAÇÃO CANAL DE SOLA:- Esquetes com Cazé e Certezas, toda quarta às 11h;- Alê Oliveira Responde, toda quinta às 19h;- Programa De Sola com Cazé e Certezas, todo sábado às 11h;- VAR do Alê Oliveira, todo domingo às 11h"
"8-GP5yWxGx4","NÃO ASSISTA ESSE FILME - ROBOSHARK !","2019-09-12T22:00:02.000Z","UCT-QobdGYczKTSuWAQbQFAA","Operação Cinema","24","19.13.09","filme|operação cinema|filmes|cinema|easter eggs|não assista esse filme|filme ruim|roboshark|tubarão robo|tubarão|filme com tubarão","180207","21898","385","1334","https://i.ytimg.com/vi/8-GP5yWxGx4/default.jpg","False","False","Compre meu livro aqui: https://www.amazon.com.br/dp/8542217489/ref=sr_1_1?qid=1567625045&refinements=p_27%3AGabriel+Dearo&s=books&sr=1-1Ou aqui também: https://www.saraiva.com.br/as-aventuras-de-mike-10605185/pVote no Operação Cinema: https://votacao.influency.me/Login.aspxNão Assista esse filme - Roboshark# ME SEGUE NO INSTA!✔ Instagram: http://instagram.com/SuperDearoEquipe:Apresentação e Direção: Gabriel DearoRoteiro: Rafael CaetanoProdução: Manuela DigilioEdição: Lucas PrecinotoMúsicas do vídeo: http://www.epidemicsound.com/"
"Ll586ATBmeY","GALAXY FOLD: UNBOXING!","2019-09-13T01:00:11.000Z","UCCbD39MVnMsTLGxsHLnOKlg","Loop Infinito","28","19.13.09","galaxy fold|galaxy|fold|samsung|smartphone|dobravel|foldable|tela|dobra|produto|android|tecnologia|hands on|unboxing|teste|analise|review|comparativo|iphone 11|juniornannetti|coreia do sul|primeiro|brasil|mundo","154687","24876","301","1077","https://i.ytimg.com/vi/Ll586ATBmeY/default.jpg","False","False","O smartphone dobrável da Samsung está entre nós! O Loop Infinito viajou até a Coreia do Sul para comprar uma das primeiras unidades oficialmente vendidas e hoje trazemos com exclusividade o primeiro vídeo do Galaxy Fold, tirando o produto da caixa!--- Sigam-me os bons --- https://twitter.com/juniornannettihttp://instagram.com/juniornannetti--- CONTATO COMERCIAL --- comercial@loopinfinito.net #galaxyfold #samsung #smartphone"
"3MPkukwwEhw","DEU RUIM? VIRAMOS COZINHEIRAS POR UMA NOITE!!","2019-09-12T20:00:02.000Z","UCA6S8QASQlEPoAAW7rodM1g","LOUD Babi","20","19.13.09","free fire|bruno|playhard|babi|coringa|loud|laud|mob|bradoock|vinizx|mobile|garena|gelli|crusher|voltan|voltam|shariin|sharin|will|will777","167413","43280","139","1326","https://i.ytimg.com/vi/3MPkukwwEhw/default.jpg","False","False","Acompanhe minhas lives: https://www.nimo.tv/loudbabiINSTAGRAM: https://www.instagram.com/loud_babi/Se inscrevam no Canal e ativem o sininho para não perder as notificações de novos videos diarios.Free Fire é um jogo com ótima qualidade FPS móbile em que no total de cinquenta jogadores que caem de paraquedas em uma ilha em busca de armas e equipamentos em tempo real a fim de matar os outros players. Os jogadores escolhem à vontade a posição inicial, pegam armas e suprimentos para aumentar o tempo de vida na batalha. Estarei dando dicas das melhores estratégias para sobrevivência e matar seus inimigos da melhor forma."
"0Vz6hCW5a2A","EU ODEIO O SISTEMA - Karen Bachini","2019-09-12T20:21:36.000Z","UCYcClChNM-0rjqCGobSfJ4A","Karen Bachini","22","19.13.09","blogueira|como fazer|maquiagem|karen bachini|kah|make up|kahbak|tutorial|passo a passo|vlog|fada sem defeitos|divertido|egraçado|cuidados com a pele|cabelo|makeup|maquiagem profissional|fotos|desafio|cosméticos|make|dia a dia|basiquinha|reboco|festa|padaria|oremos para que não caguemos|escola","194887","32160","178","1048","https://i.ytimg.com/vi/0Vz6hCW5a2A/default.jpg","False","False","OLÁ PESSOAS INCRÍVEIS DA INTERNET 🤟!Vamos falar sobre como acabar com a moda pantone! ALOKAAAAA! Mentira UDHASHUEHUAEAEDEADW👕 Compre o uniforme do clã: https://www.nerduniverse.com.br/karen💄 PRODUTOS MENCIONADOSTratamento Olheiras Peter Thomas Roth: https://rstyle.me/+lJll2EHaU4fxxuQ44SFxjAPrimer Charlotte Tilbury: https://rstyle.me/+3MuD3mBm4iZ6EhNFdQ9SEwPrimer Hourglass: https://rstyle.me/+8hJd8QCJhOyUFn6x9m89EQBase Laura Mercier: https://rstyle.me/+xJJf9VKla6_yx8f9F97lsQBase Koh Gen Do: https://rstyle.me/+wDRSPgh27tbLRaDS2OHyQQCorretivo By Terry: http://bit.ly/2Z9L9uhCorretivo Lancome: https://rstyle.me/+EKi9X2Prj9UTP9btQRUP2QCorretivo Kaja: https://rstyle.me/+iIhPKUgcCvFvEN1QSjgLdABase Lancome: https://rstyle.me/+oiQTsa4584D1NKHcHBGZzAPó Solto Charlotte Tilbury: https://rstyle.me/+iARdBwtXS8SuDTv87G53LwPó Solto Jeffree Star: http://bit.ly/2lHis4SContorno Natasha Denona: https://rstyle.me/+G3wa5h4rNrjvWcGCiJQSKQSombra Huda Beauty: https://rstyle.me/+o-RquwOJ4cFzPHseI0khUgPaleta de Sombras Huda Beauty: https://rstyle.me/+jh_xPJ0PcLNcqZugyFbKcAIluminador Givenchy: https://rstyle.me/+qX1VU6B2EQ09Vc-awvn6FwGel de Sobrancelhas Urban Decay: https://rstyle.me/+EEVi3ECyHJKJ36yrqI0uUQBlush Clinique: https://rstyle.me/+7m0iS2IaFyt75HoIFAasXwMáscara de Cílios Lancome: https://rstyle.me/+Lc3TDBmBAdzJW0QabPUdvwGloss Milk: https://rstyle.me/+rmi3hvI0eVEtM5LTkZtIaAgloss Lime Crime: http://bit.ly/2m00R8w📸 MEU INSTAGRAM http://bit.ly/2AKgPa9📺 CANAL COM RESENHAS DE PRODUTOS: http://bit.ly/2Fej5YJ🔮 INSTAGRAM COM RESENHAS APROFUNDADAS: https://bit.ly/2ZzssMQ☝🏼 Alguns dos links são afiliados - isso quer dizer que se você comprar algo após clicar neles eu ganho uma pequena comissão com a venda. Você não perde nada com isso :)💰 CUPONS DE DESCONTO: https://www.instagram.com/karenbachinii no meu insta tem uma playlist de stories com todos os cupons de deconto pro clã📬 PRESS & ENVIE MIMOS: Karen Bachini Caixa Postal 76504 | CEP 01220-970 | SP👛 ONDE COMPRO MAKESSephora BR https://rstyle.me/n/c8as344g6nSephora USA https://rstyle.me/n/c8as4c4g6nMaquiagens Coreanas(pronta entrega sem risco de taxa): https://www.noguchicosmeticos.comLojinha MQN (encomenda sem risco de taxa) https://bit.ly/2N6zWkfRosa lima SHOP(pronta entrega sem risco de taxa) https://www.rosalimashop.comFlorenza(make nacional): https://www.florenza.com.br🐣 SE VOCÊ É NOVO POR AQUISeja bem vindo a tripulação de pessoas incríveis e se inscreve logo pra não perder nada! Aproveita pra clicar no sininho de notificações e ficar por dentro de tudo! A gente fala muito de maquiagem, tecnologia e viagem, mas tudo vira assunto por aqui. Nem sempre eu acerto na maquiagem e na cor da base e quando isso acontece é apenas mais um dia na minha vida. Mas a vida é assim, e essa é a graça!💌 PROPOSTAS COMERCIAIS: comercial@eaibeleza.com🤖 EDIÇÃO MAIS TOP DO PLANETA💩SAULO EDITION - http://bit.ly/2Arseid#saipantone #nãoqueropantone #corpantonenão"
"2HMCvRGraMw","Halsey - Graveyard (Time-lapse)","2019-09-13T04:00:00.000Z","UCm3FgJ2Hqm7tb70T-GfwXVA","HalseyVEVO","10","19.13.09","halsey|graveyard|halsey graveyard|halsy graveyard|halsy|halsie|halsye|halsey without me|halsey nightmare|without me|nightmare|halsay|halse|halsey manic|manic|halse graveyard","1114847","182537","918","6009","https://i.ytimg.com/vi/2HMCvRGraMw/default.jpg","False","False","Graveyard by Halsey out now. https://halsey.lnk.to/graveyardYDSpotify: https://halsey.lnk.to/graveyardYD/spotifyApple Music: https://halsey.lnk.to/graveyardYD/applemusicAmazon: https://halsey.lnk.to/graveyardYD/amazoniTunes: https://halsey.lnk.to/graveyardYD/iTunesGoogle Play: https://halsey.lnk.to/graveyardYD/google-playFollow Halseyhttp://iamhalsey.comhttp://twitter.com/halseyhttps://www.facebook.com/HalseyMusichttp://instagram.com/iamhalsey #halsey #graveyard #timelapseMusic video by Halsey performing Graveyard (Time-lapse). © 2019 Capitol Records, LLChttp://vevo.ly/GlSjiO"
"gdmOt-0OMFI","FIZEMOS REFRIGERANTE DE CHOCOLATE !!!!","2019-09-12T15:13:23.000Z","UCvuJTWl_peL49CUfF2EAbyg","Camila Loures","24","19.13.09","camila|loures|TESTANDO MAQUINA DE REFRIGERANTE 2 !!!","558056","64009","1053","2758","https://i.ytimg.com/vi/gdmOt-0OMFI/default.jpg","False","False","MOSTRA ESSE CANAL PRA ALGUEM, UM DIA TEREMOS 10 MILHÕES DE INSCRITOS!! SEJA MEMBRO AQUI DO CANALhttps://www.youtube.com/channel/UCvuJTWl_peL49CUfF2EAbyg/joinCANAL DO PH LOURES: https://www.youtube.com/user/phlouresINSTAGRAM: https://www.instagram.com/camilaloures/?hl=ptTWITTER:  https://twitter.com/camilaloures?lang=ptPERFIL NO FACEBOOK: https://www.facebook.com/camila.loures.9EMAIL PARA CONTATO: contatocamilaloures@gmail.com"
