video_id,title,publishedAt,channelId,channelTitle,categoryId,trending_date,tags,view_count,likes,dislikes,comment_count,thumbnail_link,comments_disabled,ratings_disabled,description
"dqNEmR5uQCM","Booba - GLAIVE (Clip Officiel)","2019-09-12T13:59:54.000Z","UCNtD7oDVld6YeaYV7tCXo1A","B20baOfficiel","10","19.13.09","Booba|Tallac Records|92i|B2oba|Kopp|GLAIVE|octogone|damso|kaaris|niska|pnl|legende|duc|piraterie|dcntd|boulbi|glaive|glève|gleve|kop|kevin|dosseh|salemood|validee|scarface|pgp","1479055","94553","5154","6386","https://i.ytimg.com/vi/dqNEmR5uQCM/default.jpg","False","False","Single GLAIVE de Booba disponible : https://booba.lnk.to/GlaiveAbonne-toi : http://bit.ly/2aIsz16Réal vidéo : Chris Macari Prod By SizenDaProducer"
"leopt__ATR0","Ariana Grande, Miley Cyrus, Lana Del Rey - Don’t Call Me Angel (Charlie’s Angels)","2019-09-13T04:00:12.000Z","UC0VOyT2OCBKdQhF3BAbZ-1g","ArianaGrandeVevo","10","19.13.09","Ariana|Grande|Miley|Cyrus|Lana|Del|Rey|Don’t|Call|Me|Angel|(Charlie’s|Angels)|Republic|Records|Soundtrack","12372795","1581872","66914","116562","https://i.ytimg.com/vi/leopt__ATR0/default.jpg","False","False","Official music video by Ariana Grande, Miley Cyrus, Lana Del Rey performing “Don’t Call Me Angel (Charlie’s Angels)” – available now: https://charliesangels.lnk.to/dcmaYD►Follow Charlie’s Angels OnlineAdvanced Tickets: https://www.charliesangels.movie/tickets/?hs308=AG Watch Trailer: https://www.youtube.com/watch?v=RSUq4VfWfjE&t=52sInstagram: https://www.instagram.com/charliesangels/Facebook: https://www.facebook.com/CharliesAngels/Twitter: https://twitter.com/CharliesAngelsWebsite: https://www.charliesangels.movie/?hs308=AG►Follow Ariana Grande OnlineInstagram: https://www.instagram.com/arianagrande Facebook: https://www.facebook.com/arianagrande/ Twitter: https://twitter.com/ArianaGrande Website: https://www.arianagrande.com/ ►Follow Miley Cyrus OnlineInstagram: https://www.instagram.com/mileycyrusFacebook: https://www.facebook.com/MileyCyrusTwitter: https://twitter.com/MileyCyrusWebsite: https://mileycyrus.com/►Follow Lana Del Rey OnlineInstagram: https://www.instagram.com/lanadelrey/Facebook: https://www.facebook.com/lanadelreyTwitter: https://twitter.com/lanadelrey Website: https://lanadelrey.com/Video Director: Hannah Lux DavisVideo Producer: Brandon Bonfigliofor London Alley#CharliesAngels #DontCallMeAngelMusic video by Ariana Grande, Miley Cyrus, Lana Del Rey performing Don’t Call Me Angel (Charlie’s Angels). © 2019 Republic Records, a division of UMG Recordings, Inc. Motion Picture Artwork © CTMG.  All Rights Reserved."
"1NZY5fvxxtQ","Je soigne ma phobie de la mer","2019-09-12T17:03:20.000Z","UCWeg2Pkate69NFdBeuRFTAw","SQUEEZIE","24","19.13.09","squeezie phobie|squeezie mer|squeezie océan|squeezie vidéo phobie|squeezie requins","2829592","275216","2433","15251","https://i.ytimg.com/vi/1NZY5fvxxtQ/default.jpg","False","False","ABONNE-TOI ! http://bit.ly/2fm88Xo (merci)Vêtements Yoko : http://www.yokoshop.comRéseaux :Insta : https://www.instagram.com/xsqueezie/Twitter : http://www.twitter.com/xSqueeZieFacebook : http://www.facebook.com/SqueeZiePageOfficielleRègles de l'espace commentaire (à respecter sous peine d'être banni par l'équipe de modération) :- Écrire dans un français correct- Respecter les autres- Pas de commentaires putalike (like si tu regardes la vidéo en chaussettes par exemple)- Pas de pubs et de spams"
"KvmRDZy93Nc","PLK - Un peu de haine (Clip Officiel)","2019-09-13T10:45:38.000Z","UCL6gZm742-Xhxp4Cwa6kqpw","PLK TV","10","19.13.09","plk|polak|un peu de haine|mental|problemes|timal|maes","300833","54853","564","1566","https://i.ytimg.com/vi/KvmRDZy93Nc/default.jpg","False","False","Extrait de MENTAL nouvelle mixtape DISPO PARTOUUUT💵🧠▶️  https://panenkamusic.lnk.to/PLK-MentalInstagram : http://instagram.com/plkpbTwitter : http://twitter.com/plk75Facebook : https://www.facebook.com/plkrappeur/Snap : plk9275Réalisé par Orignal KidsProduit par HK CORPENNA MUSIC FRANCEPANENKA MUSIC"
"qqA_CmtH778","La police embarque Rico en direct ! #FreeRico #PlanèteRap","2019-09-13T10:48:52.000Z","UC5BYACI8gIm3wDlVnhKFG5A","SkyrockFM","10","19.13.09","Skyrock|Planète Rap|Rico|le poto rico|arréstation|arrestation en direct|police|à skyrock|lorenzo police|dérapage|fred|sex in the city|free rico","320666","11291","297","754","https://i.ytimg.com/vi/qqA_CmtH778/default.jpg","False","False","Abonne-toi à la chaîne ICI ► https://goo.gl/iYDY4ETélécharge l'Appli ICI ► https://goo.gl/fPnZlnDès lundi et tous les soirs de la semaine, retrouve Fred et Lorenzo dans Planète Rap !De 20h à 21h, viens découvrir en LIVE son nouvel album « Sex in the city », disponible depuis le 23 août !Site : https://skyrock.fm/Facebook : https://facebook.com/PlaneteRapSkyrockTwitter : https://twitter.com/Planete_RapInstagram : https://instagram.com/planete_rap/Twitch : https://twitch.tv/skyrockfm"
"qMjNCMLjy1w","Journal perso II","2019-09-12T22:19:16.000Z","UCud-pzOubYtXfFd3539G_hg","Vald - Topic","10","19.13.09","Vald|Journal perso II","109602","12978","120","698","https://i.ytimg.com/vi/qMjNCMLjy1w/default.jpg","False","False","Provided to YouTube by Universal Music GroupJournal perso II · ValdJournal perso II℗ 2019 Mezoued Records Et Suther Kane FilmsReleased on: 2019-09-13Associated  Performer, Vocals: ValdProducer, Associated  Performer, Programming: SeezyAssociated  Performer, Co- Arranger: Sofiane PamartAuthor: ValdComposer: SeezyAuto-generated by YouTube."
"xwIuLgsBn4o","Kalash - Salam","2019-09-13T10:00:13.000Z","UCo1BPH1dhJDUZMh_Jj4ISIw","KalashVEVO","10","19.13.09","kalash|kalash salam|Kalash salam lyrics|Kalash salam paroles|Kalash salam clip|Kalash 2019|Kalash album|kalash praline|kalash jtc|kalash lambis|kalash taken|kalash mwaka moon|mwaka moon|kalash bando|Kalash|Salam|Universal|Music|Division|Capitol|France|Rap","197840","17384","883","1035","https://i.ytimg.com/vi/xwIuLgsBn4o/default.jpg","False","False","Nouveaux singles disponibles ici : https://Kalash.lnk.to/SalamCompositeur : Play KidReal Video : Randy RoselConnecte toi avec Kalash sur ses réseaux sociaux : Facebook : https://www.facebook.com/officielKalash Twitter : https://twitter.com/kalash972 Instagram : https://instagram.com/kalash972YouTube : https://www.youtube.com/user/972KALASH?sub_confirmation=1Music video by Kalash performing Salam. © 2019 Capitol Music Francehttp://vevo.ly/rEy7El"
"o2dhWf4xJdc","Les 90's VS Aujourd'hui - Andy","2019-09-12T16:01:06.000Z","UCFcM0GoHEl6vNBdff0jBHDw","ANDY","23","19.13.09","andy|andy raconte|andy rowski|90's|90s|nineties|nadia richard|alix gavoille","751965","81067","1312","884","https://i.ytimg.com/vi/o2dhWf4xJdc/default.jpg","False","False","Si tu as vécu pendant cette période, c'est quoi tes souvenirs ?Pour tous les nostalgiques, les 80's et 90's babies, ou les millenials qui sont curieux de savoir comment on survivait sans internet à l'époque, petit retour en arrière !J'avais envie de faire cette vidéo depuis longtemps alors merci à l'équipe qui m'a permis de faire ce petit saut dans le temps :)Fais ta B.A de la journée et suis-moi sur insta ! @andyrowskiMerci à Nadia Richard  (Utile Futile) https://www.youtube.com/channel/UCRXvTfwctBJlkaJ3MbsPf8wEt à Alix Gavoille http://www.instagram/com/alixgavoilleET à Studio71 pour la production !Surtout merci à toi d'être là !! Ah si c'est pas déjà fait tu peux t'abonner tout ça tout ça, n'oublies pas de mettre la cloche pour que tu saches quand je poste une vidéo, ça t'éviteras de te demander si j'ai arrété les vidéos (Réponse : Non. pas prévu!)A dans un mois! ;)"
"nyltrR7JyuM","Soldat","2019-09-12T14:01:48.000Z","UCY7MKTmE_knveIpCPwdJv1w","Aya Nakamura - Topic","10","19.13.09","Aya Nakamura|NAKAMURA|Soldat","187277","8821","390","290","https://i.ytimg.com/vi/nyltrR7JyuM/default.jpg","False","False","Provided to YouTube by Rec. 118Soldat · Aya NakamuraNAKAMURA℗ 2019 Rec. 118 / Warner Music France, a Warner Music Group CompanyProducer: Aloïs Zandry (Perspective Production)Lead  Vocals: Aya NakamuraMasterer: Eric ChevetRecorder: Etienne MacorProgrammer: Ever MihigoProgrammer: Le SIDERecorder: MachinystMixer: Vincent AudouProducer: Vladimir Boudnikoff (Perspective Production)Lyricist: Aya NakamuraComposer: Ever MihigoLyricist: HaristoneComposer: Le SIDEAuto-generated by YouTube."
"H0hOYEpHbGM","Kery James - Les yeux mouillés (feat. Youssoupha) [Clip Officiel]","2019-09-13T10:06:17.000Z","UCjfIMz-a7tpPZCYQoD8pMEQ","Kery James","10","19.13.09","Kery James|keryjames|rap français|kery james youtube|yt:cc=on|youssoupha|netflix|banlieusards|rap","151972","16770","226","1115","https://i.ytimg.com/vi/H0hOYEpHbGM/default.jpg","False","False","Disponible en streaming 👉https://KeryJames.lnk.to/TuVoisJrapEncoreIDS'abonner à la chaîne 👉 http://bendo.eu/KeryJamesYBDans ce titre, Kery James se glisse dans la peau de Demba, le personnage qu'il interprète dans le film Banlieusards dont il a signé le scénario.Sur un thème musical tiré du long métrage co-réalisé par Leila Sy et Kery James qui sera disponible le 12 Octobre sur Netflix, Kery James nous décrit les sentiments d'un homme rongé par ses choix de vie qui craint de voir mourir sa mère.Ce titre figure dans la réédition de son dernier album Tu Vois J'RAP Encore qui contient 5 inédits dont À qui la faute en Featuring avec Orelsan, disponible dès maintenant en streaming et en téléchargement.Banlieusards : Trois frères issus d’une banlieue sensible de la région parisienne. Soulaymaan, élève avocat à Paris, réussit brillamment ses études. Son chemin croise celui de Lisa face à laquelle il débat sur la responsabilité de l'État dans la situation actuelle des banlieues lors de la finale d'un célèbre concours d'éloquence. Demba, l’aîné, vit aux rythmes du trafic et de la rue. Leur petit frère Noumouké, 15 ans, cherche encore sa voie, et doit choisir auquel de ses deux grands frères il veut ressembler. Une bagarre, un coup de feu, un drame.---------------------------------------------------------- Réalisé par Leïla Sy Auteurs : Kery James & Youssoupha Compositeurs : UssaR - Arthur Simonini - Coolax----------------------------------------------------------Rejoins Kery James sur ses réseaux :Facebook : http://bendo.eu/KeryJamesFBInstagram : http://bendo.eu/KeryJamesISTwitter : http://bendo.eu/KeryJamesTW#KeryJames #LesYeuxMouilles #Banlieusards"
"ZNnhqUF337c","NUSR-ET me COUPE MA COTE  EN OR  et me l'a FAIT DÉGUSTER","2019-09-12T17:02:51.000Z","UCNVMW8UDDZYVxXJqVs3lnUA","GameMixTreize","24","19.13.09","GameMixTreize|GMT|Gm13|lia","182297","16360","515","608","https://i.ytimg.com/vi/ZNnhqUF337c/default.jpg","False","False","Chaîne de Bella Hair Clinic : https://urlz.fr/auHtRetrouve mes musiques sur toutes les plateformes :➥ Toujours le même : https://song.link/i/1470931881➥ J'irais loin : https://song.link/i/1470931235➥ Toi et moi ( Feat Lia ) : https://song.link/i/1473522056➥ Pourquoi pas vous ? : https://song.link/i/1477221806 Ozgur insta : https://www.instagram.com/ozgur_bey/?igshid=1lj4ueqy7ophcChaine GMT : https://www.youtube.com/channel/UCRbS7-rgmqhLiKwrvdacElg?disable_polymer=1Chaine Twitch : https://www.twitch.tv/gamemixtreizeCODE CREATEUR : gamemixtreizeoffMa chaine gaming et live : https://www.youtube.com/channel/UCVsaJc0x7KZC6emL-pDOttQCommande ici : https://www.treizix.com/ - livraison offerte ( à partir de 50€ d’achat ) ➥ Instagram Treizix : https://www.instagram.com/treizix/?hl=f➥ Mon Instagram : https://lc.cx/S5Ta➥ Lia Instagram : https://www.instagram.com/liiyya_off/➥ Snapchat : gamemixtreizeyt➥ Mon Twitter : https://twitter.com/GameMixTreize➥ Ma page facebook : https://www.facebook.com/GameMixTreizeOff/➥ Bouygues Telecom http://po.st/BboxNomad4G➥ Notre boitier d'acquisition AVerMedia vidéo/stream : http://www.stealth-gamer.com/fr/streaming/acquisition-video/avermedia/avermedia-live-gamer-portable-2.html?acc=d09bf41544a3365a46c9077ebb5e35c3➥ Vous pouvez retrouver tous mon matériels gaming sur le site de Stealth Gamer bénéficié de -3% de réduction avec le code GMT http://www.stealth-gamer.com/fr/?acc=d09bf41544a3365a46c9077ebb5e35c3➥ Instant Gaming (Jeux PC -70%)  +  mon concours pour tenter de gagner 1 jeu gratuit par mois : https://www.instant-gaming.com/fr/?igr=gamixtreize"
"rqX1YGMsxbA","Cache-cache à la Tour Eiffel","2019-09-12T15:45:42.000Z","UCC_r3spMB5i5QKgtdNVO0OQ","Pierre Croce","23","19.13.09","pierre|croce|pierrecroce|funny|marrante|drole|vidéo|vidéos|youtubeur|lol|fun|comedie|comedy|comedien|benjamin|verrecchia","1061288","87200","648","2382","https://i.ytimg.com/vi/rqX1YGMsxbA/default.jpg","False","False","On l'a fait messieurs dames, le dernier cache-cache de cette chaîne, on ne pourra pas aller plus haut que çaMerci à la Tour Eiffel pour son accueil, suivez-là sur Insta, elle poste des photos de ouf : https://www.instagram.com/toureiffelofficielle/Merci à tous ceux présents dans la vidéo :Swann Périssée : https://www.youtube.com/user/swannperisseEmy Ltr : https://www.youtube.com/channel/UCuZ6w38DjAZwQj0PlNZT5sQBenjamin Verrecchia : https://www.youtube.com/benjaminverrecchiaMorgan VS : https://www.youtube.com/channel/UCXwummUhfF-o4o9YXiJUT8AAmixem : https://www.youtube.com/user/FPSCoopGameplaysFred : https://www.instagram.com/fredvanlong/Guillaume : https://www.instagram.com/guillaumesantin/Plus d'infos sur l'expo des 130 ans de la Tour Eiffel : https://www.toureiffel.paris/fr/actualites/130-ans/lexpo-des-130-ans-le-rendez-vous-de-lautomneMerci à Laura Gilli pour les photos, allez faire un tour sur son insta : https://www.instagram.com/laurag_photo/Ma seconde chaîne : https://bit.ly/2M4dpYrMon instagram : https://instagram.com/pierrecroce/Mon Twitch : https://www.twitch.tv/mrpierrecroceMon twitter : https://twitter.com/PierreCroceMontage : Pierre-Antoine LerouxAlexandre SoubeyrandCamille Lévêque (elle a aussi une chaîne youtube : https://bit.ly/2KxFqUU )Quentin LegacPréparation vidéo : Auriane Vanesse / Guillaume SantinCrédit vidéo drone : Skytour"
"FF62tfxNAF8","mise au point","2019-09-11T15:41:20.000Z","UCylUZ30a2U2t_dv4QXex9Hw","Sundy Jules","24","19.13.09","sundy vlog|sundy jules|mise au point","636156","44443","3383","3258","https://i.ytimg.com/vi/FF62tfxNAF8/default.jpg","False","False",""
"scKwDXeNpCw","LORIS - LA CORSE - AJACCIO","2019-09-12T17:30:00.000Z","UCsTK8xMZKkrbTeWc8REbn8Q","LORIS GIULIANO","23","19.13.09","loris|giuliano|nrj|radio|caute|caméra|cachée|park|ski|boite|de|nuit|papi|mamie|chantent|rap|français|niska|orelsan|jul|vald|désacordé|poulouloulou|réseaux|west|alors|basique|simple|marseille|montpellier|paris|france|italie|football|police|arrestation|svetlana|stagiaire|golden news|micro trottoir|loris à la rue|la corse|tour de france|golden moustache|quartiers nords|toulouse|bordeaux","361534","23533","230","1466","https://i.ytimg.com/vi/scKwDXeNpCw/default.jpg","False","False","Abonnez-vous à ma chaîne !INSTAGRAM : https://www.instagram.com/loris.giuliano/TWITTER : https://twitter.com/Loris_GiulianoFACEBOOK : https://www.facebook.com/GiulianoLoris/Le Tour de France avec Loris Pendant 2 mois, 2 villes par semaine, 2 vidéos par semaine, le lundi et le jeudi !Dites moi en commentaire dans quelles villes vous voulez que je vienne :)Merci aux Produits Laitiers de me permettre de faire ce tour de France ❤️"
"UJ3DcIXVf70","CHIT CHAT COFFEE : Ce que je vous ai caché pendant 1 an. - Horia","2019-09-12T15:30:01.000Z","UCZMCU61JkQkqleoU7VyGncQ","Horia","26","19.13.09","youtubeuse beauté|horia|youtubeuse|maquillage|humour|vlog|CHIT CHAT|chit chat make up|chit chat coffee|ce que je vous ai caché|ce que je n'ai pas dit|vérité|tag","380487","32475","301","1510","https://i.ytimg.com/vi/UJ3DcIXVf70/default.jpg","False","False","J'ai décidé de revenir aujourd'hui sur tout ce que je ne vous ai pas dit pendant plus d'une année. Je vide un peu mon sac pour que vous puissiez comprendre pourquoi j'ai eu certains comportements ! Et avec du café, c'est plus facile 🤷🏻‍♀️👑 S'abonner → https://goo.gl/llf6cE 👑⚠️ N'oublie pas d'activer les notifications (clique sur la petite cloche en haut) si tu ne veux pas louper mes vidéos ! ⚠️  ___● MES ACTUALITÉS  ●- La fin d'un chapitre → https://youtu.be/hSzH1t7mu_Y- Action ou vérité ? → https://youtu.be/N5eQ1dLdNp8___● MES RÉSEAUX SOCIAUX ●B L O G → http://horialeblog.com/I N S T A G R A M → http://instagram.com/horia_instaS N A P C H A T → Horia_Youtube T W I T T E R → https://twitter.com/HoriaF A C E B O O K → https://www.facebook.com/HoriaOfficiel___● CODES PROMOS ●- 25$ offerts sur votre 1er hébergement Airbnb → https://goo.gl/IWFYLQ- Jusqu'à 45% de remboursement sur vos achats → http://goo.gl/a35gq6___● MES SITES PRÉFÉRÉS ●MAQUILLAGE- Sephora → https://goo.gl/e4nVUY- L'Oréal Paris → https://goo.gl/bZzqb7- NYX cosmetics → https://goo.gl/aUYxxqVÊTEMENTS- Asos → https://goo.gl/9h86MX- Undiz → https://goo.gl/kdG5vH- Forever21 → https://goo.gl/bYAe3d___CONTACT PROFESSIONNEL → contact@horialeblog.com(les mails non-pros sont supprimés sans être lus !)___» Si tu as lu jusque là, insère le mot GRAIN discrètement dans un commentaire sous cette vidéo, bonne chance :PMerci à tous pour tout votre amour, votre soutien, et votre bonne humeur, OLIVE YOU.___Disclaimer : Cette vidéo n'est pas sponsorisée."
"nmqNjeritSo","PIMP MY BIKE - Episode 1- La 85 yz de Kob","2019-09-12T17:34:31.000Z","UCDbC6tVdvOdvxk7vspAZc1w","TCQR","24","19.13.09","Dave|jerome|maure|weediful|tcqr","142704","6776","105","391","https://i.ytimg.com/vi/nmqNjeritSo/default.jpg","False","False","PRONOS : PACINOPRONOS13LIEN UTIP: https://utip.io/tcqrLIEN UTIP: https://utip.io/tcqrLIEN UTIP: https://utip.io/tcqrT-SHIRT : https://www.btbgraphic.com/product-page/tee-shirt-tcqrSnapchat : tcqrmotorREJOINS NOUS SUR INSTAGRAM: TCQR_MOTORMusique d'intro : Seho - Pour ma FamilleSNAPCHAT: tcqrmotorINSTAGRAM: tcqr_motorINSTAGRAM : jerome_maureSNAPCHAT: Jerome_mrVous êtes de plus en plus nombreux , merci beaucoup.Demande sérieuse: tcqrmotor@gmail.com"
"FCA85PPzwRY","USA v France - Highlights - Quarter-Finals - FIBA Basketball World Cup 2019","2019-09-11T13:18:19.000Z","UCtInrnU3QbWqFGsdKT1GZtg","FIBA","17","19.13.09","FIBA Basketball World Cup 2019|FIBA Basketball World Cup|FIBA World Cup|FIBA World Cup 2019|Basketball World Cup|basketball highlights|Highlights|USA|France|USA France|USA France highlights|USA France basketball|USA basketball|France basketball|USA v FRA 11.09.2019|USA (USA)|France (FRA)|FRA|sp:ty=high|sp:dt=2019-09-11T11:00:00Z|sp:st=basketball|sp:li=fiba_world_cup_international|sp:ti:home=USA|sp:ti:away=FRA|Quarter-Finals","1132116","8111","428","2130","https://i.ytimg.com/vi/FCA85PPzwRY/default.jpg","False","False","Watch the Highlights from the quarter-final game between USA and France at the FIBA Basketball World Cup 2019.►► Subscribe & hit the bell! 🔔: http://fiba.com/subYTDownload the official FIBA Basketball World Cup APP 📱 now ➡ http://bit.ly/FIBAWC--APPClick here for more: http://WorldCup.basketballFacebook: http://facebook.com/FIBAWCTwitter: http://twitter.com/FIBAWCInstagram: http://instagr.am/FIBAWCSina Weibo: http://weibo.com/FIBAWC#USAGotGame #FranceGotGame #FIBAWC"
"SGbl49RZVQ4","Zola - Fuckboi (Prod By Kore)","2019-09-11T14:00:46.000Z","UCz_lud52KfAbVTanpedusUw","Zola","10","19.13.09","zola nino|papers|fuckboy|fuckboi|fuckboa|zola ninho papers|parole fuckboi zola|parole papers zola|paroles fuckboi zola|zola 2019|fuckboi clip|fuckboy clip|zola album|zola clip|zola manger|zola cicatrice|zola cicatrices|zola l1l2|L1L2|zola mojo|zola baby boy|ninho zola|zola extasy|zola ft ninho|zola fuck boi|zola fuckboi|Zola Cicatrices","508361","53278","1087","2396","https://i.ytimg.com/vi/SGbl49RZVQ4/default.jpg","False","False","Album Cicatrices maintenant disponible : https://lnk.to/ZolaCicatricesZola en tournée dans toutes la France : http://bit.ly/2VAtZ6JBoutique officielle de Zola : https://binkszolashop.comAbonne-toi à la chaîne → https://www.youtube.com/channel/UCz_lud52KfAbVTanpedusUw?view_as=subscriberRéalisé par Arthur Keasy - #NVZProductionProd By Kore pour #AwaGangContact Management / Booking : contact@truthrecords.frRetrouvez Zola sur : Instagram : https://www.instagram.com/binkszola/Facebook : https://www.facebook.com/BinksZola91/Snapchat 👻 : http://www.snapchat.com/add/binkszola© Truth Records 2019                                   #TruthRecords"
"nJ1AJKD0dqY","NO COMMENT - ZAPPING DE LA SEMAINE EP.10 with Navas, Icardi & Mbappé","2019-09-13T10:15:15.000Z","UCt9a_qP9CqHCNwilf-iULag","PSG - Paris Saint-Germain","17","19.13.09","paris saint-germain|psg|paris|football|PSG|PARIS|SAINT-GERMAIN|PARC|DES|PRINCES|NEYMAR|Jr|Neymar|Mbappe|Mbappé|kylian|ney|THIAGO|SILVA|ANGEL|DI|MARIA|EDINSON|CAVANI|skills|geste|technique|highlights|inside|Psg","115968","4450","86","197","https://i.ytimg.com/vi/nJ1AJKD0dqY/default.jpg","False","False","🔴🔵🎥Subscribe to the Paris Saint-Germain channel. 👉 http://smarturl.it/PSGOfficiel🔴🔵🎥 Abonnez-vous à la chaîne du Paris Saint Germain 👉 http://smarturl.it/PSGOfficiel"
"QWOC8gniPSs","La Boîte à Questions de Lorenzo – 11/09/2019","2019-09-11T17:10:54.000Z","UCRyS6LtMoI78jqIrAFIMd-Q","La Boîte à Questions","24","19.13.09","baq|la boite à question|lorenzo|la baq|baq canal|canal plus|shy'm|canal|rap|rappeur|mamène","442616","19203","327","275","https://i.ytimg.com/vi/QWOC8gniPSs/default.jpg","False","False","Où tu apprends que Lorenzo est complètement love de Shy’m ❤"
"IcjFBDY4rWM","LOU & LENNI-KIM | Ce mur qui nous sépare | Miraculous - Clip officiel","2019-09-13T10:00:12.000Z","UCIpBLlcyR1W6oEji4_qdrQA","MIRACULOUS - Les aventures de Ladybug et Chat Noir","10","19.13.09","Miraculous|Miraculous Ladybug|Lou|Lenni-Kim|Lou The Voice Kids|Lou Miraculous|Disney Channel|Gulive|Peppa Pig|Le roi Lion|La reine des neiges|Musique|Clip|Chansons|Kids United Nouvelle Génération|Bilal Hassani|Ladybug|Chat Noir|Adrien|Marinette|Paris|Bigflo et Oli|Erza Muqolli|Swan The Voice|Ce mur qui nous sépare|The wall between us|Lenni-Kim 18|Lenni-kim Miraculous|Miraculous clip|Miraculous musique|Miraculous film|Angèle|the voice","167190","18388","300","1134","https://i.ytimg.com/vi/IcjFBDY4rWM/default.jpg","False","False","► Abonne-toi à la chaine Officielle de Miraculous : https://www.youtube.com/channel/UCIpBLlcyR1W6oEji4_qdrQA?sub_confirmation=1► Les vidéos musiques Miraculous : https://www.youtube.com/watch?v=xdq_sYfmN6c&list=PLxSkhyb5SYw85M4V2MD_QnvKdXTlv3xiq&index=2&t=0s► Les vidéos musiques de Lou : https://www.youtube.com/playlist?list=PLMTFTdUhcwD4Z98CIPPPoceO5ui2qSK8J► Voir + de vidéos Miraculous : https://www.youtube.com/watch?v=9CVnpItmly4&list=PLxSkhyb5SYw_lprbJQ3HFq6CDOwnxffck&index=3&t=0sCe mur qui nous sépare, la nouvelle musique interprétée par Lou & Lenni-Kim et inspirée de l'univers Miraculous, disponible sur toutes les plateformes digitales. Paris, aujourd'hui.Marinette et Adrien sont deux collégiens pas comme les autres. Ils ont été choisis pour sauver Paris ! Leur mission : capturer les akumas qui transforment les gens en super vilains.Quand ils sauvent Paris, ils se transforment en super-héros : Marinette devient Ladybug, Adrien devient Chat Noir.Mais Ladybug et Chat Noir ne connaissent pas la véritable identité de l’autre. Marinette ne sait pas que, derrière le costume du Chat Noir, se cache Adrien, le garçon dont elle est amoureuse en secret. Lui non plus ne sait pas que Ladybug est en réalité Marinette, l’une des filles de sa classe…Miraculous™ is a trademark of ZAG - Method © 2019 ZAGTOON / METHOD ANIMATION / UNE MUSIQUE / TF1 MUSIQUE, un label de TF1 ENTERTAINMENT© 2019 ZAGTOON / METHOD ANIMATION/ UNE MUSIQUE ℗ 2019 ZAGTOON / METHOD ANIMATION/ UNE MUSIQUE© 2018 - ZAGTOON - METHOD ANIMATION - TOEI ANIMATION - SAMG - SK BROADBAND - AB INTERNATIONAL - DE AGOSTINI EDITORE S.p.A.#Miraculous #Lou #LenniKim"
"hG8jCPxQt6k","LES MEILLEURES BLAGUES PROFS VS ÉLÈVES !","2019-09-12T17:41:15.000Z","UC5_fByWZfmtHOQb1ie9578g","TheFragHD","20","19.13.09","meilleure blague|meilleures blagues|profs|élève|prof|élèves|les profs vs les eleves|prof vs élèves|blagues|blague|blague prof|blagues de prof|punchline prof|punchline eleve|punchline de prof|vs|profs vs élèves|les meilleures blagues|meilleures|eleves|eleve prof|prof eleves|parents profs eleves|eleves profs|prof et eleve|blague cours|blague école|blagues en cours|blagues à l'école|the frag hd|thefraghd blague|the frag hd blague|thefraghd","162194","16106","731","3092","https://i.ytimg.com/vi/hG8jCPxQt6k/default.jpg","False","False","LES MEILLEURES BLAGUES PROFS VS ÉLÈVES !HUMILIATION, VANNES, BLAGUES ET CLASH..📸Mon Instagram : thefraghdytb👻Mon Snapchat (tout le monde peut m'ajouter) : thefraghd🔵Ma page Facebook : http://lc.cx/Wc3 🐤Mon Twitter : http://twitter.com/#!/TheFragHD📧Mail pro : thefraghdcontactpro@gmail.comNouveau concept sous forme de zapping, alors je compte sur vous pour faire péter la barre des j'aimes svp ! Montrez moi que ma communauté est encore là pour me soutenir :p Plus la vidéo aura de retour, plus je vous  en re proposerai d'autres !#blagues #prof #élève"
